,player_link,Year,Rnd,DT,OvPck,FrRnd,RdPck,Tm,Signed,Name,Pos,WAR,G,AB,HR,BA,OPS,G,W,L,ERA,WHIP,SV,Type,Drafted Out of
0,/register/player.cgi?id=fernan002ale,1990,1,,4,FrRnd,4,White Sox,Y,Alex FernandezåÊ(minors),RHP,28.9,266,126,3,0.175,0.537,263,107,87,3.74,1.28,0,4Yr,"Miami-Dade College, Kendall Campus (Miami, FL)"
1,/register/player.cgi?id=miller001kur,1990,1,,5,FrRnd,5,Pirates,Y,Kurt MilleråÊ(minors),RHP,-2.6,44,14,0,0.286,0.571,44,2,7,7.48,1.91,0,HS,"West HS (Bakersfield, CA)"
2,/register/player.cgi?id=walden001ron,1990,1,,9,FrRnd,9,Dodgers,Y,Ron WaldenåÊ(minors),LHP,,,,,,,,,,,,,HS,"Blanchard HS (Blanchard, OK)"
3,/register/player.cgi?id=ritchi001tod,1990,1,,12,FrRnd,12,Twins,Y,Todd RitchieåÊ(minors),RHP,6.3,187,187,0,0.176,0.409,184,43,54,4.71,1.43,0,HS,"Duncanville HS (Duncanville, TX)"
4,/register/player.cgi?id=osborn002don,1990,1,,13,FrRnd,13,Cardinals,Y,Donovan OsborneåÊ(minors),LHP,5.7,166,259,1,0.162,0.422,163,49,46,4.03,1.31,0,4Yr,"University of Nevada-Las Vegas (Las Vegas, NV)"
5,/register/player.cgi?id=vanpop001tod,1990,1,,14,FrRnd,14,Athletics via Brewers,Y,*Todd Van PoppelåÊ(minors),RHP,-0.2,359,57,0,0.158,0.362,359,40,52,5.58,1.55,4,HS,"James W. Martin HS (Arlington, TX)"
6,/register/player.cgi?id=smith-015dan,1990,1,,16,FrRnd,16,Rangers,Y,Dan SmithåÊ(minors),LHP,0,17,0,0,,,17,1,5,4.66,1.93,0,4Yr,"Creighton University (Omaha, NE)"
7,/register/player.cgi?id=mussin001mic,1990,1,,20,FrRnd,20,Orioles,Y,Mike MussinaåÊ(minors),RHP,83,537,52,0,0.173,0.381,537,270,153,3.68,1.19,0,4Yr,"Stanford University (Palo Alto, CA)"
8,/register/player.cgi?id=karsay001ste,1990,1,,22,FrRnd,22,Blue Jays,Y,Steve KarsayåÊ(minors),RHP,11.2,358,4,0,0,0,357,32,39,4.01,1.38,41,HS,"Christ the King HS (Queens, NY)"
9,/register/player.cgi?id=dickso001lan,1990,1,,23,FrRnd,23,Cubs,Y,Lance DicksonåÊ(minors),LHP,-0.3,3,3,0,0,0,3,0,3,7.24,1.76,0,4Yr,"University of Arizona (Tucson, AZ)"
10,/register/player.cgi?id=becket001rob,1990,1,,25,FrRnd,25,Padres via Royals,Y,*Robbie BeckettåÊ(minors),LHP,-0.3,7,0,0,,,7,0,0,11.57,2.43,0,HS,"McCallum HS (Austin, TX)"
11,/register/player.cgi?id=peters001don,1990,1,,26,FrRnd,26,Athletics,Y,Don PetersåÊ(minors),RHP,,,,,,,,,,,,,4Yr,"University of St. Francis (Joliet, IL)"
12,/register/player.cgi?id=zimmer001mic,1990,1s,,27,FrRnd,27,Pirates,Y,*Mike ZimmermanåÊ(minors),RHP,,,,,,,,,,,,,4Yr,"University of South Alabama (Mobile, AL)"
13,/register/player.cgi?id=white-001gab,1990,1s,,28,FrRnd,28,Expos,Y,*Gabe WhiteåÊ(minors),LHP,6.5,472,38,1,0.105,0.312,472,34,26,4.51,1.22,17,HS,"Sebring HS (Sebring, FL)"
14,/register/player.cgi?id=willia005bri,1990,1s,,31,FrRnd,31,Astros,Y,*Brian WilliamsåÊ(minors),RHP,-4,260,85,0,0.176,0.398,256,26,38,5.37,1.66,6,4Yr,"University of South Carolina (Columbia, SC)"
15,/register/player.cgi?id=sander001sco,1990,1s,,32,FrRnd,32,Padres,Y,*Scott SandersåÊ(minors),RHP,4.7,236,129,0,0.194,0.464,235,34,45,4.86,1.39,5,4Yr,"Nicholls State University (Thibodaux, LA)"
16,/register/player.cgi?id=zancan001dav,1990,1s,,34,FrRnd,34,Athletics,Y,*Dave ZancanaroåÊ(minors),LHP,,,,,,,,,,,,,4Yr,"University of California, Los Angeles (Los Angeles, CA)"
17,/register/player.cgi?id=spence002sta,1990,1s,,35,FrRnd,35,Expos,Y,*Stan SpenceråÊ(minors),RHP,-0.5,24,31,0,0.161,0.413,23,3,9,5.54,1.37,0,4Yr,"Stanford University (Palo Alto, CA)"
18,/register/player.cgi?id=dresse001kir,1990,1s,,36,FrRnd,36,Athletics,Y,*Kirk DressendorferåÊ(minors),RHP,-0.8,7,0,0,,,7,3,3,5.45,1.56,0,4Yr,"University of Texas at Austin (Austin, TX)"
19,/register/player.cgi?id=vanryn001ben,1990,1s,,37,FrRnd,37,Expos,Y,*Ben VanRynåÊ(minors),LHP,-0.1,26,1,0,0,0,26,0,2,5.74,2.04,0,HS,"East Noble HS (Kendaliville, IN)"
20,/register/player.cgi?id=rodrig002fra,1990,2,,41,FrRnd,1,Red Sox via Braves,Y,*Frankie RodriguezåÊ(minors),RHP,1.2,186,6,0,0.167,0.333,184,29,39,5.53,1.56,5,HS,"Eastern District HS (Brooklyn, NY)"
21,/register/player.cgi?id=shaw--002mal,1990,2,,42,FrRnd,2,Athletics via Tigers,Y,*Curtis ShawåÊ(minors),LHP,,,,,,,,,,,,,4Yr,"University of Kansas (Lawrence, KS)"
22,/register/player.cgi?id=schwei000tim,1990,2,,43,FrRnd,3,Phillies,N,Tim SchweitzeråÊ(minors),LHP,,,,,,,,,,,,,HS,"Reedsport HS (Reedsport, OR)"
23,/register/player.cgi?id=wickma001rob,1990,2,,44,FrRnd,4,White Sox,Y,Bob WickmanåÊ(minors),RHP,17.2,835,2,0,0,0,835,63,61,3.57,1.4,267,4Yr,"University of Wisconsin at Whitewater (Whitewater, WI)"
24,/register/player.cgi?id=alvare002ces,1990,2,,50,FrRnd,10,Expos via Yankees,Y,*Tavo AlvarezåÊ(minors),RHP,-0.3,19,16,0,0.125,0.25,19,3,6,5.4,1.56,0,HS,"Tucson HS (Tucson, AZ)"
25,/register/player.cgi?id=haney-001chr,1990,2,,51,FrRnd,11,Expos,Y,Chris HaneyåÊ(minors),LHP,3.2,197,36,0,0.111,0.222,196,38,52,5.07,1.47,1,4Yr,"University of North Carolina at Charlotte (Charlotte, NC)"
26,/register/player.cgi?id=schief001mic,1990,2,,56,FrRnd,16,Rangers,N,Mike SchiefelbeinåÊ(minors),RHP,,,,,,,,,,,,,HS,"Chatfield HS (Littleton, CO)"
27,/register/player.cgi?id=carida001ron,1990,2,,58,FrRnd,18,Twins via Red Sox,Y,*Ron CaridadåÊ(minors),RHP,,,,,,,,,,,,,HS,"Westminster Christian (Miami, FL)"
28,/register/player.cgi?id=schull001eri,1990,2,,60,FrRnd,20,Orioles,Y,Erik SchullstromåÊ(minors),RHP,-0.2,46,0,0,,,46,0,0,6,1.77,1,4Yr,"California State University Fresno (Fresno, CA)"
29,/register/player.cgi?id=prado-002jos,1990,2,,61,FrRnd,21,Giants,N,Jose PradoåÊ(minors),RHP,,,,,,,,,,,,,HS,"Coral Gables HS (Coral Gables, FL)"
30,/register/player.cgi?id=hawbli001rya,1990,2,,63,FrRnd,23,Cubs,Y,Ryan HawblitzelåÊ(minors),RHP,-0.1,8,1,0,0,0,8,0,1,6,1.6,0,HS,"John I. Leonard HS (Greenacres, FL)"
31,/register/player.cgi?id=leftwi001phi,1990,2,,64,FrRnd,24,Angels,Y,Phil LeftwichåÊ(minors),RHP,2.5,34,0,0,,,34,9,17,4.99,1.45,0,4Yr,"Radford University (Radford, VA)"
32,/register/player.cgi?id=malone000eri,1990,2s,,67,FrRnd,27,White Sox,N,*Eric MaloneyåÊ(minors),RHP,,,,,,,,,,,,,HS,"Carmel HS (Mundelein, IL)"
33,/register/player.cgi?id=willia004jef,1990,2s,,69,FrRnd,29,Orioles,Y,*Jeff WilliamsåÊ(minors),RHP,,,,,,,,,,,,,4Yr,"Wichita State University (Wichita, KS)"
34,/register/player.cgi?id=rossel001jos,1990,2s,,70,FrRnd,30,Giants,Y,*Joe RosselliåÊ(minors),LHP,-1,9,10,0,0.2,0.4,9,2,1,8.7,1.97,0,HS,"Bishop Alemany HS (Mission Hills, CA)"
35,/register/player.cgi?id=bradfo001tro,1990,2s,,72,FrRnd,32,Cubs,Y,*Troy BradfordåÊ(minors),RHP,,,,,,,,,,,,,4Yr,"University of Arizona (Tucson, AZ)"
36,/register/player.cgi?id=freema001sco,1990,2s,,73,FrRnd,33,Dodgers,Y,*Scott FreemanåÊ(minors),RHP,,,,,,,,,,,,,4Yr,"University of Wyoming (Laramie, WY)"
37,/register/player.cgi?id=ellis-002rob,1990,3,,77,FrRnd,4,White Sox,Y,Robert EllisåÊ(minors),RHP,-0.5,29,26,0,0.154,0.339,29,7,7,6.03,1.58,0,JC,"Panola College (Carthage, TX)"
38,/register/player.cgi?id=flemin001dav,1990,3,,79,FrRnd,6,Mariners,Y,Dave FlemingåÊ(minors),LHP,5.3,116,0,0,,,116,38,32,4.67,1.5,0,4Yr,"University of Georgia (Athens, GA)"
39,/register/player.cgi?id=tobin-001dan,1990,3,,80,FrRnd,7,Reds,Y,Dan TobinåÊ(minors),RHP,,,,,,,,,,,,,HS,"Dowagiac Union HS (Dowagiac, MI)"
40,/register/player.cgi?id=mathil001mic,1990,3,,84,FrRnd,11,Expos,Y,Mike MathileåÊ(minors),RHP,,,,,,,,,,,,,4Yr,"Wright State University (Dayton, OH)"
41,/register/player.cgi?id=reed--002rob,1990,3,,89,FrRnd,16,Rangers,Y,Bobby ReedåÊ(minors),RHP,,,,,,,,,,,,,4Yr,"Mississippi State University (Mississippi State, MS)"
42,/register/player.cgi?id=huisma001ric,1990,3,,94,FrRnd,21,Giants,Y,Rick HuismanåÊ(minors),RHP,0.3,29,0,0,,,29,2,1,5.31,1.49,1,4Yr,"Lewis University (Romeoville, IL)"
43,/register/player.cgi?id=parker003j--,1990,3,,96,FrRnd,23,Cubs,Y,Tim ParkeråÊ(minors),RHP,,,,,,,,,,,,,4Yr,"Clemson University (Clemson, SC)"
44,/register/player.cgi?id=rea---001sha,1990,3,,98,FrRnd,25,Royals,Y,Shayne ReaåÊ(minors),RHP,,,,,,,,,,,,,JC,"Henry Ford Community College (Dearborn, MI)"
45,/register/player.cgi?id=garlan001cha,1990,3,,99,FrRnd,26,Athletics,Y,Chaon GarlandåÊ(minors),RHP,,,,,,,,,,,,,4Yr,"Haverford College in Pennsylvania (Haverford, PA)"
46,/register/player.cgi?id=ingram002joh,1990,4,,104,FrRnd,5,Phillies,Y,John IngramåÊ(minors),LHP,,,,,,,,,,,,,JC,"Los Angeles Harbor College (Wilmington, CA)"
47,/register/player.cgi?id=baldwi001jam,1990,4,,105,FrRnd,6,White Sox,Y,James BaldwinåÊ(minors),RHP,9.2,266,44,0,0.091,0.25,266,79,74,5.01,1.46,2,HS,"Pinecrest HS (Southern Pines, NC)"
48,/register/player.cgi?id=ferry-001mic,1990,4,,108,FrRnd,9,Reds,Y,Mike FerryåÊ(minors),RHP,,,,,,,,,,,,,4Yr,"Auburn University (Auburn, AL)"
49,/register/player.cgi?id=ojala-001kir,1990,4,,111,FrRnd,12,Yankees,Y,Kirt OjalaåÊ(minors),LHP,0.1,56,33,0,0.121,0.346,56,3,10,4.71,1.58,0,4Yr,"University of Michigan (Ann Arbor, MI)"
50,/register/player.cgi?id=censal001sil,1990,4,,113,FrRnd,14,Twins,N,Silvio CensaleåÊ(minors),LHP,,,,,,,,,,,,,HS,"Catholic HS (Paramus, NJ)"
51,/register/player.cgi?id=blair-002don,1990,4,,115,FrRnd,16,Brewers,Y,Donnie BlairåÊ(minors),RHP,,,,,,,,,,,,,HS,"Wabash HS (Wabash, IN)"
52,/register/player.cgi?id=henson003mic,1990,4,,117,FrRnd,18,Rangers,Y,Mickey HensonåÊ(minors),RHP,,,,,,,,,,,,,HS,"South Point HS (Belmont, NC)"
53,/register/player.cgi?id=silcox001rus,1990,4,,120,FrRnd,21,Padres,Y,Rusty SilcoxåÊ(minors),RHP,,,,,,,,,,,,,4Yr,"Arizona State University (Tempe, AZ)"
54,/register/player.cgi?id=myers-004mic,1990,4,,122,FrRnd,23,Giants,Y,Mike MyersåÊ(minors),LHP,8.5,883,2,0,0,0,883,25,24,4.29,1.44,14,4Yr,"Iowa State University (Ames, IA)"
55,/register/player.cgi?id=cheeth001sea,1990,4,,124,FrRnd,25,Cubs,Y,Sean CheethamåÊ(minors),RHP,,,,,,,,,,,,,HS,"Woodbridge HS (Woodbridge, VA)"
56,/register/player.cgi?id=harris001dou,1990,4,,126,FrRnd,27,Royals,Y,Doug HarrisåÊ(minors),RHP,,,,,,,,,,,,,4Yr,"James Madison University (Harrisonburg, VA)"
57,/register/player.cgi?id=withem001sha,1990,5,,130,FrRnd,3,Tigers,Y,Shannon WithemåÊ(minors),RHP,0,1,0,0,,,1,0,0,3,1.67,0,HS,"Willow Run HS (Ypsilanti, MI)"
58,/register/player.cgi?id=coombs001gle,1990,5,,133,FrRnd,6,Pirates,Y,Glenn CoombsåÊ(minors),RHP,,,,,,,,,,,,,HS,"Cypress Creek HS (Houston, TX)"
59,/register/player.cgi?id=munoz-002jua,1990,5,,136,FrRnd,9,Indians,Y,Oscar MunozåÊ(minors),RHP,-0.3,10,0,0,,,10,2,1,5.6,1.61,0,4Yr,"University of Miami (Coral Gables, FL)"
60,/register/player.cgi?id=clella001ric,1990,5,,139,FrRnd,12,Expos,Y,Rick ClellandåÊ(minors),RHP,,,,,,,,,,,,,HS,"Buckeye North HS (Brilliant, OH)"
61,/register/player.cgi?id=lewis-003jam,1990,5,,141,FrRnd,14,Cardinals,N,Jim LewisåÊ(minors),RHP,,,,,,,,,,,,,JC,"Florida College (Jacksonville, FL)"
62,/register/player.cgi?id=chouin001rob,1990,5,,148,FrRnd,21,Orioles,Y,Bobby ChouinardåÊ(minors),RHP,1.5,111,8,0,0.125,0.25,111,11,8,4.57,1.45,1,HS,"Forest Grove HS (Forest Grove, OR)"
63,/register/player.cgi?id=burrel001sco,1990,5,,150,FrRnd,23,Blue Jays,Y,Scott BurrellåÊ(minors),RHP,,,,,,,,,,,,,4Yr,"University of Connecticut (Storrs, CT)"
64,/register/player.cgi?id=godfre001tys,1990,5,,151,FrRnd,24,Cubs,Y,Tyson GodfreyåÊ(minors),RHP,,,,,,,,,,,,,HS,"Aberdeen HS (Aberdeen, WA)"
65,/register/player.cgi?id=creek-001pau,1990,5,,152,FrRnd,25,Angels,N,Doug CreekåÊ(minors),LHP,-1.1,279,5,0,0.2,0.4,279,7,14,5.32,1.6,1,4Yr,"Georgia Institute of Technology (Atlanta, GA)"
66,/register/player.cgi?id=wolf--001ste,1990,6,,157,FrRnd,3,Tigers,Y,Steve WolfåÊ(minors),RHP,,,,,,,,,,,,,4Yr,"California State University Fresno (Fresno, CA)"
67,/register/player.cgi?id=hampto002mic,1990,6,,161,FrRnd,7,Mariners,Y,Mike HamptonåÊ(minors),LHP,29,448,725,16,0.246,0.65,419,148,115,4.06,1.44,1,HS,"Crystal River HS (Crystal River, FL)"
68,/register/player.cgi?id=milite001sam,1990,6,,165,FrRnd,11,Yankees,Y,Sam MilitelloåÊ(minors),RHP,1.2,12,0,0,,,12,4,4,3.89,1.33,0,4Yr,"University of Tampa (Tampa, FL)"
69,/register/player.cgi?id=long--001ste,1990,6,,166,FrRnd,12,Expos,Y,Steve LongåÊ(minors),RHP,,,,,,,,,,,,,4Yr,"St. Xavier University (Orland Park, IL)"
70,/register/player.cgi?id=sells-001geo,1990,6,,168,FrRnd,14,Cardinals,Y,George SellsåÊ(minors),LHP,,,,,,,,,,,,,4Yr,"Old Dominion University (Norfolk, VA)"
71,/register/player.cgi?id=mcgraw002tho,1990,6,,169,FrRnd,15,Brewers,Y,Tom McGrawåÊ(minors),LHP,0.1,2,0,0,,,2,0,0,0,1.8,0,4Yr,"Washington State University (Pullman, WA)"
72,/register/player.cgi?id=finnvo001and,1990,6,,173,FrRnd,19,Red Sox,Y,Gar FinnvoldåÊ(minors),RHP,0,8,0,0,,,8,0,4,5.94,1.65,0,4Yr,"Florida State University (Tallahassee, FL)"
73,/register/player.cgi?id=fyock-001wad,1990,6,,180,FrRnd,26,Royals,Y,Wade FyockåÊ(minors),RHP,,,,,,,,,,,,,HS,"Somerset HS (Somerset, PA)"
74,/register/player.cgi?id=adamso001joe,1990,7,,185,FrRnd,4,Phillies,Y,Joel AdamsonåÊ(minors),LHP,0.2,44,10,0,0.3,0.7,44,5,6,4.89,1.43,0,JC,"Cerritos College (Norwalk, CA)"
75,/register/player.cgi?id=king--004kev,1990,7,,188,FrRnd,7,Mariners,Y,Kevin KingåÊ(minors),LHP,-0.7,34,0,0,,,34,0,3,7.34,1.92,0,4Yr,"University of Oklahoma (Norman, OK)"
76,/register/player.cgi?id=persin001tim,1990,7,,194,FrRnd,13,Twins,Y,Tim PersingåÊ(minors),RHP,,,,,,,,,,,,,4Yr,"Mansfield University of Pennsylvania (Mansfield, PA)"
77,/register/player.cgi?id=baker-001sco,1990,7,,195,FrRnd,14,Cardinals,Y,Scott BakeråÊ(minors),LHP,-0.1,1,0,0,,,1,0,0,9.82,2.73,0,JC,"Taft College (Taft, CA)"
78,/register/player.cgi?id=nix---002dav,1990,7,,197,FrRnd,16,Astros,Y,David NixåÊ(minors),LHP,,,,,,,,,,,,,HS,"Harrison HS (Evansville, IN)"
79,/register/player.cgi?id=burrow001ter,1990,7,,198,FrRnd,17,Rangers,Y,Terry BurrowsåÊ(minors),LHP,-1.2,50,0,0,,,50,4,4,6.42,1.79,1,4Yr,"McNeese State University (Lake Charles, LA)"
80,/register/player.cgi?id=walker001pet,1990,7,,199,FrRnd,18,Mets,Y,Pete WalkeråÊ(minors),RHP,3.7,144,1,0,0,0,144,20,14,4.48,1.46,4,4Yr,"University of Connecticut (Storrs, CT)"
81,/register/player.cgi?id=miller002tod,1990,7,,200,FrRnd,19,Red Sox,Y,Todd MilleråÊ(minors),RHP,,,,,,,,,,,,,4Yr,"Temple University (Philadelphia, PA)"
82,/register/player.cgi?id=hale--002joh,1990,7,,202,FrRnd,21,Orioles,Y,Shane HaleåÊ(minors),LHP,,,,,,,,,,,,,4Yr,"University of South Alabama (Mobile, AL)"
83,/register/player.cgi?id=brow--001sco,1990,7,,204,FrRnd,23,Blue Jays,Y,Scott BrowåÊ(minors),RHP,-1.4,59,1,0,0,0,59,3,4,6.06,1.76,2,4Yr,"University of Washington (Seattle, WA)"
84,/register/player.cgi?id=sanche001adr,1990,7,,205,FrRnd,24,Cubs,Y,Adrian SanchezåÊ(minors),RHP,,,,,,,,,,,,,HS,"Rio Grande HS (Albuquerque, NM)"
85,/register/player.cgi?id=powers001ran,1990,7,,206,FrRnd,25,Angels,Y,Randy PowersåÊ(minors),RHP,,,,,,,,,,,,,4Yr,"University of Southern California (Los Angeles, CA)"
86,/register/player.cgi?id=vizzin001dan,1990,7,,208,FrRnd,27,Athletics,Y,Dan VizziniåÊ(minors),LHP,,,,,,,,,,,,,4Yr,"Francis Marion University (Florence, SC)"
87,/register/player.cgi?id=conger001jef,1990,8,,214,FrRnd,6,Pirates,Y,Jeff CongeråÊ(minors),LHP,,,,,,,,,,,,,HS,"Charlotte Latin HS (Charlotte, NC)"
88,/register/player.cgi?id=cummin005joh,1990,8,,215,FrRnd,7,Mariners,Y,John CummingsåÊ(minors),LHP,-0.8,110,3,0,0,0,110,10,15,5.33,1.65,0,4Yr,"University of Southern California (Los Angeles, CA)"
89,/register/player.cgi?id=luebbe001lar,1990,8,,216,FrRnd,8,Reds,Y,Larry LuebbersåÊ(minors),RHP,-0.2,36,40,0,0.2,0.458,36,5,10,4.96,1.49,1,4Yr,"University of Kentucky (Lexington, KY)"
90,/register/player.cgi?id=bryant002sha,1990,8,,217,FrRnd,9,Indians,Y,Shawn BryantåÊ(minors),LHP,,,,,,,,,,,,,4Yr,"Oklahoma City University (Oklahoma City, OK)"
91,/register/player.cgi?id=kerr--001c--,1990,8,,218,FrRnd,10,Dodgers,Y,Jason KerråÊ(minors),LHP,,,,,,,,,,,,,JC,"Cerritos College (Norwalk, CA)"
92,/register/player.cgi?id=rumer-001tim,1990,8,,219,FrRnd,11,Yankees,Y,Tim RumeråÊ(minors),LHP,,,,,,,,,,,,,4Yr,"Duke University (Durham, NC)"
93,/register/player.cgi?id=dreyer001ste,1990,8,,225,FrRnd,17,Rangers,Y,Steve DreyeråÊ(minors),RHP,-0.3,15,0,0,,,15,4,4,5.71,1.63,0,4Yr,"University of Northern Iowa (Cedar Falls, IA)"
94,/register/player.cgi?id=kniepe001aar,1990,8,,227,FrRnd,19,Red Sox,N,Aaron KnieperåÊ(minors),RHP,,,,,,,,,,,,,HS,"Nouvel Catholic HS (Saginaw, MI)"
95,/register/player.cgi?id=mcgehe001geo,1990,8,,230,FrRnd,22,Giants,Y,Kevin McGeheeåÊ(minors),RHP,-0.1,5,0,0,,,5,0,0,5.94,1.5,0,4Yr,"Louisiana Tech University (Ruston, LA)"
96,/register/player.cgi?id=menhar001pau,1990,8,,231,FrRnd,23,Blue Jays,Y,Paul MenhartåÊ(minors),RHP,0.3,41,12,0,0,0,41,5,9,5.47,1.54,0,4Yr,"Western Carolina University (Cullowhee, NC)"
97,/register/player.cgi?id=gregor001m--,1990,9,,236,FrRnd,1,Miami Miracle,Y,Brad GregoryåÊ(minors),P,,,,,,,,,,,,,4Yr,"Florida State University (Tallahassee, FL)"
98,/register/player.cgi?id=coppet001gre,1990,9,,238,FrRnd,3,Tigers,Y,Greg CoppetaåÊ(minors),LHP,,,,,,,,,,,,,4Yr,"University of Southern Maine (Gorham, ME)"
99,/register/player.cgi?id=mcgraw001wal,1990,9,,240,FrRnd,5,White Sox,Y,Doug McGrawåÊ(minors),RHP,,,,,,,,,,,,,HS,"Duncanville HS (Duncanville, TX)"
100,/register/player.cgi?id=robert005ric,1990,9,,241,FrRnd,6,Pirates,Y,Rich RobertsonåÊ(minors),LHP,0.7,114,9,0,0.222,0.444,114,17,30,5.4,1.67,0,4Yr,"Texas A&M; University (College Station, TX)"
101,/register/player.cgi?id=carlyl001ken,1990,9,,243,FrRnd,8,Reds,N,Ken CarlyleåÊ(minors),RHP,,,,,,,,,,,,,4Yr,"University of Mississippi (Oxford, MS)"
102,/register/player.cgi?id=botts-001jac,1990,9,,245,FrRnd,10,Dodgers,Y,Jake BottsåÊ(minors),RHP,,,,,,,,,,,,,HS,"North Monterey County HS (Castroville, CA)"
103,/register/player.cgi?id=humphr001tre,1990,9,,248,FrRnd,13,Twins,N,Trevor HumphryåÊ(minors),RHP,,,,,,,,,,,,,HS,"Delight HS (Delight, AR)"
104,/register/player.cgi?id=mcdona009jam,1990,9,,250,FrRnd,15,Brewers,Y,Kevin McDonaldåÊ(minors),RHP,,,,,,,,,,,,,4Yr,"University of Louisiana at Lafayette (Lafayette, LA)"
105,/register/player.cgi?id=correa001jor,1990,9,,251,FrRnd,16,Astros,Y,Jorge CorreaåÊ(minors),RHP,,,,,,,,,,,,,HS,"Miami Senior HS (Miami, FL)"
106,/register/player.cgi?id=wells-001tim,1990,9,,252,FrRnd,17,Rangers,Y,Tim WellsåÊ(minors),RHP,,,,,,,,,,,,,4Yr,"Missouri State University (Springfield, MO)"
107,/register/player.cgi?id=collet001j--,1990,9,,254,FrRnd,19,Red Sox,N,Mike CollettåÊ(minors),RHP,,,,,,,,,,,,,JC,"Citrus College (Glendora, CA)"
108,/register/player.cgi?id=narcis001tyr,1990,9,,255,FrRnd,20,Padres,Y,Ty NarcisseåÊ(minors),RHP,,,,,,,,,,,,,HS,"Lincoin HS (Port Arthur, TX)"
109,/register/player.cgi?id=flener001gre,1990,9,,258,FrRnd,23,Blue Jays,Y,Huck FleneråÊ(minors),LHP,0.5,29,0,0,,,29,3,3,5.51,1.67,0,4Yr,"California State University Fullerton (Fullerton, CA)"
110,/register/player.cgi?id=lee---002ant,1990,9,,261,FrRnd,26,Royals,Y,Tony LeeåÊ(minors),RHP,,,,,,,,,,,,,HS,"Eldorado HS (Las Vegas, NV)"
111,/register/player.cgi?id=whitwo001ken,1990,10,,263,FrRnd,1,Miami Miracle,Y,Kenneth WhitworthåÊ(minors),P,,,,,,,,,,,,,4Yr,"University of California, Irvine (Irvine, CA)"
112,/register/player.cgi?id=wallac001sta,1990,10,,269,FrRnd,7,Mariners,Y,Reese WallaceåÊ(minors),RHP,,,,,,,,,,,,,HS,"Lufkin HS (Lufkin, TX)"
113,/register/player.cgi?id=foster002cli,1990,10,,270,FrRnd,8,Reds,N,Cliff FosteråÊ(minors),RHP,,,,,,,,,,,,,JC,"Angelina College (Lufkin, TX)"
114,/register/player.cgi?id=hamilt001ken,1990,10,,272,FrRnd,10,Dodgers,Y,Kenny HamiltonåÊ(minors),RHP,,,,,,,,,,,,,JC,"Patrick Henry Junior College (Monroeville, AL)"
115,/register/player.cgi?id=hodges001dar,1990,10,,273,FrRnd,11,Yankees,Y,Darren HodgesåÊ(minors),RHP,,,,,,,,,,,,,4Yr,"Ferrum College (Ferrum, VA)"
116,/register/player.cgi?id=archer001kur,1990,10,,277,FrRnd,15,Brewers,Y,Kurt ArcheråÊ(minors),RHP,,,,,,,,,,,,,4Yr,"San Diego State University (San Diego, CA)"
117,/register/player.cgi?id=boehri001bri,1990,10,,278,FrRnd,16,Astros,N,Brian BoehringeråÊ(minors),RHP,3.9,356,31,0,0.065,0.244,356,26,32,4.36,1.49,3,4Yr,"University of Nevada-Las Vegas (Las Vegas, NV)"
118,/register/player.cgi?id=singer001tho,1990,10,,285,FrRnd,23,Blue Jays,Y,Tom SingeråÊ(minors),LHP,,,,,,,,,,,,,4Yr,"St. John's University (Queens, NY)"
119,/register/player.cgi?id=toth--001rob,1990,10,,288,FrRnd,26,Royals,Y,Robert TothåÊ(minors),RHP,,,,,,,,,,,,,HS,"Pacifica HS (Garden Grove, CA)"
120,/register/player.cgi?id=stidha001phi,1990,11,,291,FrRnd,2,Braves,N,Phil StidhamåÊ(minors),RHP,-0.5,5,0,0,,,5,0,0,24.92,3.69,0,4Yr,"University of Arkansas (Fayetteville, AR)"
121,/register/player.cgi?id=johnso004car,1990,11,,298,FrRnd,9,Indians,Y,Carl JohnsonåÊ(minors),RHP,,,,,,,,,,,,,JC,"Lassen College (Susanville, CA)"
122,/register/player.cgi?id=hines-002ric,1990,11,,300,FrRnd,11,Yankees,Y,Rich HinesåÊ(minors),RHP,,,,,,,,,,,,,4Yr,"University of Mississippi (Oxford, MS)"
123,/register/player.cgi?id=swope-001mar,1990,11,,302,FrRnd,13,Twins,Y,Mark SwopeåÊ(minors),RHP,,,,,,,,,,,,,4Yr,"University of Arkansas (Fayetteville, AR)"
124,/register/player.cgi?id=souza-001bri,1990,11,,304,FrRnd,15,Brewers,Y,Brian SouzaåÊ(minors),RHP,,,,,,,,,,,,,4Yr,"University of Hawaii at Manoa (Honolulu, HI)"
125,/register/player.cgi?id=powers001ter,1990,11,,308,FrRnd,19,Red Sox,Y,Terry PowersåÊ(minors),RHP,,,,,,,,,,,,,JC,"Volunteer State Community College (Gallatin, TN)"
126,/register/player.cgi?id=powell004jam,1990,11,,309,FrRnd,20,Padres,N,Jay PowellåÊ(minors),RHP,3.1,513,12,0,0.167,0.333,512,36,23,4.17,1.5,22,HS,"West Lauderdale HS (Collinsville, MS)"
127,/register/player.cgi?id=peltze001kur,1990,11,,311,FrRnd,22,Giants,Y,Kurt PeltzeråÊ(minors),LHP,,,,,,,,,,,,,4Yr,"University of Wisconsin at Madison (Madison, WI)"
128,/register/player.cgi?id=young-007mic,1990,11,,313,FrRnd,24,Cubs,Y,Mike YoungåÊ(minors),RHP,,,,,,,,,,,,,4Yr,"Anderson University (Anderson, IN)"
129,/register/player.cgi?id=craft-001mar,1990,11,,316,FrRnd,27,Athletics,Y,Mark CraftåÊ(minors),RHP,,,,,,,,,,,,,4Yr,"Virginia Military Institute (Lexington, VA)"
130,/register/player.cgi?id=nettni001rod,1990,12,,317,FrRnd,1,Miami Miracle,Y,Rod NettninåÊ(minors),P,,,,,,,,,,,,,4Yr,"University of Nevada-Reno (Reno, NV)"
131,/register/player.cgi?id=bark--001bri,1990,12,,318,FrRnd,2,Braves,Y,Brian BarkåÊ(minors),LHP,0.1,3,0,0,,,3,0,0,0,1.29,0,4Yr,"North Carolina State University (Raleigh, NC)"
132,/register/player.cgi?id=anders001cha,1990,12,,320,FrRnd,4,Phillies,Y,Chad AndersonåÊ(minors),RHP,,,,,,,,,,,,,HS,"Roseburg HS (Roseburg, OR)"
133,/register/player.cgi?id=victor000lui,1990,12,,323,FrRnd,7,Mariners,N,Luis VictoriaåÊ(minors),RHP,,,,,,,,,,,,,,
134,/register/player.cgi?id=roper-001joh,1990,12,,324,FrRnd,8,Reds,Y,John RoperåÊ(minors),RHP,0.1,35,62,0,0.177,0.384,35,8,7,5.35,1.49,0,HS,"Hoke County HS (Raeford, NC)"
135,/register/player.cgi?id=sides-001mic,1990,12,,325,FrRnd,9,Indians,Y,Craig SidesåÊ(minors),RHP,,,,,,,,,,,,,JC,"Jefferson Davis Community College (Brewton, AL)"
136,/register/player.cgi?id=frazie002ron,1990,12,,327,FrRnd,11,Yankees,Y,Ron FrazieråÊ(minors),RHP,,,,,,,,,,,,,4Yr,"Clemson University (Clemson, SC)"
137,/register/player.cgi?id=baxter003rob,1990,12,,328,FrRnd,12,Expos,Y,Bob BaxteråÊ(minors),LHP,,,,,,,,,,,,,4Yr,"Harvard University (Cambridge, MA)"
138,/register/player.cgi?id=boze--001mar,1990,12,,331,FrRnd,15,Brewers,Y,Marshall BozeåÊ(minors),RHP,-0.8,25,0,0,,,25,0,2,7.79,2.23,1,JC,"Southwestern College (Chula Vista, CA)"
139,/register/player.cgi?id=watson001and,1990,12,,333,FrRnd,17,Rangers,Y,Andy WatsonåÊ(minors),RHP,,,,,,,,,,,,,JC,"Crowder College (Neosho, MO)"
140,/register/player.cgi?id=vanryn001cas,1990,12,,334,FrRnd,18,Mets,Y,Cap Van RynbachåÊ(minors),RHP,,,,,,,,,,,,,JC,"Iowa Western Community College (Council Bluffs, IA)"
141,/register/player.cgi?id=valdes001ped,1990,12,,340,FrRnd,24,Cubs,N,Pedro ValdesåÊ(minors),LHP,-0.1,53,85,1,0.247,0.7,,,,,,,HS,"Carlos Escobar Lopez HS (Loiza, PR)"
142,/register/player.cgi?id=myers-002rod,1990,12,,342,FrRnd,26,Royals,Y,Rodney MyersåÊ(minors),RHP,-1.2,167,18,0,0.167,0.389,167,7,5,5.07,1.56,1,4Yr,"University of Wisconsin at Madison (Madison, WI)"
143,/register/player.cgi?id=bolton001rod,1990,13,,348,FrRnd,5,White Sox,Y,Rod BoltonåÊ(minors),RHP,-1.6,17,0,0,,,17,2,8,7.69,1.83,0,4Yr,"University of Kentucky (Lexington, KY)"
144,/register/player.cgi?id=shouse001bri,1990,13,,349,FrRnd,6,Pirates,Y,Brian ShouseåÊ(minors),LHP,5.4,467,0,0,,,467,13,10,3.72,1.33,6,4Yr,"Bradley University (Peoria, IL)"
145,/register/player.cgi?id=kaluhi000kek,1990,13,,350,FrRnd,7,Mariners,N,Kekoa KaluhiokalaniåÊ(minors),RHP,,,,,,,,,,,,,HS,"Waianae HS (Waianae, HI)"
146,/register/player.cgi?id=whiteh001tod,1990,13,,352,FrRnd,9,Indians,Y,Todd WhitehurståÊ(minors),RHP,,,,,,,,,,,,,HS,"North Monterey County HS (Castroville, CA)"
147,/register/player.cgi?id=davis-002gre,1990,13,,353,FrRnd,10,Dodgers,Y,Greg DavisåÊ(minors),RHP,,,,,,,,,,,,,JC,"El Camino College (Torrance, CA)"
148,/register/player.cgi?id=whitak002ste,1990,13,,356,FrRnd,13,Twins,N,Steve WhitakeråÊ(minors),LHP,,,,,,,,,,,,,JC,"Merced College (Merced, CA)"
149,/register/player.cgi?id=urbani001tho,1990,13,,357,FrRnd,14,Cardinals,Y,Tom UrbaniåÊ(minors),LHP,-0.5,83,65,1,0.246,0.627,81,10,17,4.98,1.54,0,4Yr,"California State University Long Beach (Long Beach, CA)"
150,/register/player.cgi?id=yaughn001kip,1990,13,,364,FrRnd,21,Orioles,Y,Kip YaughnåÊ(minors),RHP,,,,,,,,,,,,,4Yr,"Arizona State University (Tempe, AZ)"
151,/register/player.cgi?id=henric001sha,1990,13,,365,FrRnd,22,Giants,N,Shawn HenrichsåÊ(minors),RHP,,,,,,,,,,,,,JC,"Linn-Benton Community College (Albany, OR)"
152,/register/player.cgi?id=holman001cra,1990,13,,366,FrRnd,23,Blue Jays,N,Craig HolmanåÊ(minors),RHP,,,,,,,,,,,,,4Yr,"Jacksonville State University (Jacksonville, AL)"
153,/register/player.cgi?id=gurtne000ste,1990,13,,367,FrRnd,24,Cubs,N,Stephen GurtneråÊ(minors),RHP,,,,,,,,,,,,,HS,"Holy Cross HS (Chalmette, LA)"
154,/register/player.cgi?id=hancoc001rya,1990,13,,368,FrRnd,25,Angels,N,Ryan HancockåÊ(minors),RHP,-0.2,11,1,0,1,2,11,4,1,7.48,1.84,0,HS,"Monta Vista HS (Cupertino, CA)"
