,player_link,Year,Rnd,DT,OvPck,FrRnd,RdPck,Tm,Signed,Name,Pos,WAR,G,AB,HR,BA,OPS,G,W,L,ERA,WHIP,SV,Type,Drafted Out of
52,/register/player.cgi?id=ritche000jam,1991,23,,613,FrRnd,20,Reds,N,James RitcheyåÊ(minors),C,,,,,,,,,,,,,HS,"Copperas Cove HS (Copperas Cove, TX)"
53,/register/player.cgi?id=quinte001joh,1991,24,,620,FrRnd,1,Yankees,Y,John QuintellåÊ(minors),C,,,,,,,,,,,,,4Yr,"California State University Sacramento (Sacramento, CA)"
54,/register/player.cgi?id=ghostl001der,1991,26,,676,FrRnd,5,Brewers,Y,Derek GhostlawåÊ(minors),C,,,,,,,,,,,,,4Yr,"Bentley College (Waltham, MA)"
55,/register/player.cgi?id=andreo001ale,1991,26,,679,FrRnd,8,Padres,N,Alex AndreopoulosåÊ(minors),C,,,,,,,,,,,,,HS,"Harbord Collegiate Institute (Toronto, ON)"
56,/register/player.cgi?id=henley001rob,1991,26,,685,FrRnd,14,Expos,N,Bob HenleyåÊ(minors),C,1.2,41,115,3,0.304,0.846,,,,,,,HS,"Mobile County HS (Grand Bay, AL)"
57,/register/player.cgi?id=ramire001hir,1991,26,,687,FrRnd,16,Giants,Y,Peto RamirezåÊ(minors),C,,,,,,,,,,,,,,
58,/register/player.cgi?id=maier-002wil,1991,27,,699,FrRnd,2,Braves,Y,William MaieråÊ(minors),C,,,,,,,,,,,,,JC,"Raritan Valley Community College (North Branch, NJ)"
59,/register/player.cgi?id=wagner001kyl,1991,27,,703,FrRnd,6,Astros,N,Kyle WagneråÊ(minors),C,,,,,,,,,,,,,HS,"Red Land HS (Lewisberry, PA)"
60,/register/player.cgi?id=cady--001tod,1991,27,,708,FrRnd,11,Mariners,N,Todd CadyåÊ(minors),C,,,,,,,,,,,,,HS,"Grossmont HS (El Cajon, CA)"
61,/register/player.cgi?id=kellih001pau,1991,28,,725,FrRnd,2,Braves,Y,Paul KelliheråÊ(minors),C,,,,,,,,,,,,,4Yr,"University of Maine at Orono (Orono, ME)"
62,/register/player.cgi?id=baucom001cha,1991,28,,726,FrRnd,3,Twins,Y,Chad BaucomåÊ(minors),C,,,,,,,,,,,,,HS,"Hibbing HS (Hibbing, MN)"
63,/register/player.cgi?id=belyeu001ran,1991,28,,735,FrRnd,12,Cubs,Y,Randy BelyeuåÊ(minors),C,,,,,,,,,,,,,4Yr,"Jacksonville State University (Jacksonville, AL)"
64,/register/player.cgi?id=dana--001der,1991,28,,739,FrRnd,16,Giants,Y,Derek DanaåÊ(minors),C,,,,,,,,,,,,,4Yr,"University of Massachusetts Amherst (Amherst, MA)"
65,/register/player.cgi?id=barwic001lya,1991,29,,766,FrRnd,17,Angels,N,Lyall BarwickåÊ(minors),C,,,,,,,,,,,,,JC,"Delgado Community College (New Orleans, LA)"
66,/register/player.cgi?id=sobole001mar,1991,30,,780,FrRnd,5,Brewers,N,Mark SobolewskiåÊ(minors),C,,,,,,,,,,,,,4Yr,"Florida Southern College (Lakeland, FL)"
67,/register/player.cgi?id=johnso002jac,1991,30,,793,FrRnd,18,Dodgers,Y,Jack JohnsonåÊ(minors),C,,,,,,,,,,,,,4Yr,"University of Arizona (Tucson, AZ)"
68,/register/player.cgi?id=friedr001ste,1991,31,,804,FrRnd,3,Twins,N,Steve FriedrichåÊ(minors),C,,,,,,,,,,,,,HS,"Troy HS (Fullerton, CA)"
69,/register/player.cgi?id=hall--001tim,1991,31,,809,FrRnd,8,Padres,Y,Tim HallåÊ(minors),C,,,,,,,,,,,,,4Yr,"Cumberland University (Lebanon, TN)"
70,/register/player.cgi?id=monday001mic,1991,31,,818,FrRnd,17,Angels,N,Mike MondayåÊ(minors),C,,,,,,,,,,,,,JC,"Orange Coast College (Costa Mesa, CA)"
71,/register/player.cgi?id=dreisb001g--,1991,31,,821,FrRnd,20,Reds,Y,Bill DreisbachåÊ(minors),C,,,,,,,,,,,,,4Yr,"West Liberty State College (West Liberty, WV)"
72,/register/player.cgi?id=sander001pau,1991,32,,834,FrRnd,7,Royals,Y,Paul SandersåÊ(minors),C,,,,,,,,,,,,,4Yr,"Oregon State University (Corvallis, OR)"
73,/register/player.cgi?id=bensch001ada,1991,32,,843,FrRnd,16,Giants,Y,Adam BenschoteråÊ(minors),C,,,,,,,,,,,,,4Yr,"Siena Heights University (Adrian, MI)"
74,/register/player.cgi?id=rossle001bre,1991,32,,849,FrRnd,22,Mets,Y,Brett RossleråÊ(minors),C,,,,,,,,,,,,,JC,"Pearl River Community College (Poplarville, MS)"
75,/register/player.cgi?id=haase-001dea,1991,32,,852,FrRnd,25,White Sox,Y,Dean HaaseåÊ(minors),C,,,,,,,,,,,,,4Yr,"University of Wisconsin at Oshkosh (Oshkosh, WI)"
76,/register/player.cgi?id=gresha001kri,1991,33,,862,FrRnd,9,Orioles,Y,Kris GreshamåÊ(minors),C,,,,,,,,,,,,,4Yr,"University of North Carolina at Charlotte (Charlotte, NC)"
77,/register/player.cgi?id=kirkpa001les,1991,33,,871,FrRnd,18,Dodgers,Y,Jay KirkpatrickåÊ(minors),C,,,,,,,,,,,,,4Yr,"Methodist College (Fayetteville, NC)"
78,/register/player.cgi?id=vinas-001jul,1991,33,,878,FrRnd,25,White Sox,Y,Julio VinasåÊ(minors),C,,,,,,,,,,,,,HS,"American HS (Miami, FL)"
79,/register/player.cgi?id=pruett000ton,1991,34,,885,FrRnd,6,Astros,N,Tony PruettåÊ(minors),C,,,,,,,,,,,,,JC,"El Camino College (Torrance, CA)"
80,/register/player.cgi?id=marrer001ina,1991,34,,894,FrRnd,15,Tigers,Y,Kenny MarreroåÊ(minors),C,,,,,,,,,,,,,JC,"Arizona Western College (Yuma, AZ)"
81,/register/player.cgi?id=hopp--001dea,1991,35,,915,FrRnd,10,Phillies,Y,Dean HoppåÊ(minors),C,,,,,,,,,,,,,JC,"Northeast Oklahoma A&M; College (Miami, OK)"
82,/register/player.cgi?id=nuttin001rob,1991,35,,917,FrRnd,12,Cubs,N,Rob NuttingåÊ(minors),C,,,,,,,,,,,,,HS,"Riverton HS (Galena, KS)"
83,/register/player.cgi?id=mccubb001sha,1991,35,,919,FrRnd,14,Expos,N,Shane McCubbinåÊ(minors),C,,,,,,,,,,,,,JC,"Western Oklahoma State College (Altus, OK)"
84,/register/player.cgi?id=taylor005jer,1991,35,,928,FrRnd,23,Red Sox,N,Jerry TayloråÊ(minors),C,,,,,,,,,,,,,HS,"Goliad HS (Goliad, TX)"
85,/register/player.cgi?id=doezie001dav,1991,36,,934,FrRnd,3,Twins,N,Troy DoezieåÊ(minors),C,,,,,,,,,,,,,HS,"Brighton HS (Sandy, UT)"
86,/register/player.cgi?id=hicks-000pat,1991,36,,940,FrRnd,9,Orioles,N,Patrick HicksåÊ(minors),C,,,,,,,,,,,,,JC,"Mesa Community College (Mesa, AZ)"
87,/register/player.cgi?id=plarsk000rob,1991,36,,948,FrRnd,17,Angels,N,Rob PlarskiåÊ(minors),C,,,,,,,,,,,,,HS,"Poway HS (Poway, CA)"
88,/register/player.cgi?id=moore-001mic,1991,37,,970,FrRnd,13,Indians,Y,Mike MooreåÊ(minors),C,,,,,,,,,,,,,4Yr,"West Virginia University (Morgantown, WV)"
89,/register/player.cgi?id=marine001war,1991,37,,972,FrRnd,15,Tigers,N,Del MarineåÊ(minors),C,,,,,,,,,,,,,4Yr,"Moorpark College (Moorpark, CA)"
90,/register/player.cgi?id=kenned003jam,1991,37,,976,FrRnd,19,Rangers,Y,Darryl KennedyåÊ(minors),C,,,,,,,,,,,,,4Yr,"University of North Florida (Jacksonville, FL)"
91,/register/player.cgi?id=smith-004bra,1991,37,,983,FrRnd,26,Athletics,Y,Brandon SmithåÊ(minors),C,,,,,,,,,,,,,HS,"Roswell HS (Roswell, GA)"
92,/register/player.cgi?id=sherwo003rob,1991,38,,996,FrRnd,13,Indians,N,Robert SherwoodåÊ(minors),C,,,,,,,,,,,,,HS,"John Burroughs HS (Burbank, CA)"
93,/register/player.cgi?id=sherbe000joh,1991,38,,1003,FrRnd,20,Reds,N,John SherbertåÊ(minors),C,,,,,,,,,,,,,HS,"Whiteville HS (Whiteville, NC)"
94,/register/player.cgi?id=vivenz001aug,1991,39,,1011,FrRnd,2,Braves,Y,Augie VivenzioåÊ(minors),C,,,,,,,,,,,,,4Yr,"Lynn University (Boca Raton, FL)"
95,/register/player.cgi?id=hillis001jon,1991,39,,1012,FrRnd,3,Twins,N,Jon HillisåÊ(minors),C,,,,,,,,,,,,,JC,"Alvin Community College (Alvin, TX)"
96,/register/player.cgi?id=crum--000mau,1991,39,,1014,FrRnd,5,Brewers,N,Maurice CrumåÊ(minors),C,,,,,,,,,,,,,4Yr,"University of Miami (Coral Gables, FL)"
97,/register/player.cgi?id=skeels002dav,1991,39,,1021,FrRnd,12,Cubs,N,David SkeelsåÊ(minors),C,,,,,,,,,,,,,HS,"Thousand Oaks HS (Thousand Oaks, CA)"
98,/register/player.cgi?id=stefan002mic,1991,40,,1040,FrRnd,5,Brewers,Y,Mike StefanskiåÊ(minors),C,,,,,,,,,,,,,4Yr,"University of Detroit Mercy (Detroit, MI)"
99,/register/player.cgi?id=hauswi001tre,1991,40,,1042,FrRnd,7,Royals,N,Trenton HauswirthåÊ(minors),C,,,,,,,,,,,,,JC,"College of the Desert (Palm Desert, CA)"
100,/register/player.cgi?id=afenir001ste,1991,40,,1045,FrRnd,10,Phillies,N,Tom AfeniråÊ(minors),C,,,,,,,,,,,,,JC,"Palomar College (San Marcos, CA)"
101,/register/player.cgi?id=taylor006mic,1991,40,,1048,FrRnd,13,Indians,Y,Mike TayloråÊ(minors),C,,,,,,,,,,,,,JC,"Brookdale Community College (Lincroft, NJ)"
102,/register/player.cgi?id=gay---002bra,1991,41,,1065,FrRnd,5,Brewers,N,Brad GayåÊ(minors),C,,,,,,,,,,,,,JC,"Hillsborough Community College (Tampa, FL)"
103,/register/player.cgi?id=casten000hec,1991,41,,1069,FrRnd,9,Orioles,N,Hector CastenadaåÊ(minors),C,,,,,,,,,,,,,JC,"Laredo Community College (Laredo, TX)"
104,/register/player.cgi?id=montgo001don,1991,41,,1076,FrRnd,16,Giants,Y,Don MontgomeryåÊ(minors),C,,,,,,,,,,,,,4Yr,"Lewis-Clark State College (Lewiston, ID)"
105,/register/player.cgi?id=cerio-001ste,1991,42,,1089,FrRnd,4,Cardinals,Y,Steve CerioåÊ(minors),C,,,,,,,,,,,,,4Yr,"University of Nevada-Las Vegas (Las Vegas, NV)"
106,/register/player.cgi?id=cavana000mik,1991,42,,1099,FrRnd,14,Expos,N,Mike CavanaughåÊ(minors),C,,,,,,,,,,,,,4Yr,"Linfield College (McMinnville, OR)"
107,/register/player.cgi?id=bergen000joe,1991,43,,1113,FrRnd,3,Twins,N,Joe BergenåÊ(minors),C,,,,,,,,,,,,,JC,"Mesa Community College (Mesa, AZ)"
108,/register/player.cgi?id=bishop006wil,1991,43,,1135,FrRnd,25,Athletics,N,William BishopåÊ(minors),C,,,,,,,,,,,,,JC,"Mississippi Gulf Coast Community College (Perkinston, MS)"
109,/register/player.cgi?id=gourdi001tho,1991,44,,1138,FrRnd,3,Twins,N,Tom GourdinåÊ(minors),C,,,,,,,,,,,,,HS,"Murray HS (Murray, UT)"
110,/register/player.cgi?id=coburn001tod,1991,44,,1141,FrRnd,6,Astros,N,Todd CoburnåÊ(minors),C,,,,,,,,,,,,,JC,"Butte College (Oroville, CA)"
111,/register/player.cgi?id=vargas001eri,1991,44,,1154,FrRnd,19,Rangers,Y,Eric VargasåÊ(minors),C,,,,,,,,,,,,,4Yr,"University of California, Berkeley (Berkeley, CA)"
112,/register/player.cgi?id=moore-006jas,1991,44,,1158,FrRnd,23,Pirates,N,Jason MooreåÊ(minors),C,,,,,,,,,,,,,JC,"Sacramento City College (Sacramento, CA)"
113,/register/player.cgi?id=frick-001tod,1991,44,,1160,FrRnd,25,Athletics,Y,Tod FrickåÊ(minors),C,,,,,,,,,,,,,4Yr,"Florida Southern College (Lakeland, FL)"
114,/register/player.cgi?id=johnso006kev,1991,45,,1168,FrRnd,8,Padres,Y,Kevin JohnsonåÊ(minors),C,,,,,,,,,,,,,4Yr,"Mayville State University (Mayville, ND)"
115,/register/player.cgi?id=morlan001mic,1991,45,,1181,FrRnd,21,Blue Jays,Y,Mike MorlandåÊ(minors),C,,,,,,,,,,,,,4Yr,"University of Texas at Austin (Austin, TX)"
116,/register/player.cgi?id=gatlin000jam,1991,46,,1198,FrRnd,13,Indians,N,James GatlinåÊ(minors),C,,,,,,,,,,,,,HS,"Cedar Hills HS (Cedar Hills, TX)"
117,/register/player.cgi?id=calcag001dan,1991,46,,1201,FrRnd,16,Giants,Y,Danny CalcagnoåÊ(minors),C,,,,,,,,,,,,,4Yr,"Sonoma State University (Rohnert Park, CA)"
118,/register/player.cgi?id=lewis-012wil,1991,47,,1221,FrRnd,11,Mariners,N,William LewisåÊ(minors),C,,,,,,,,,,,,,HS,"East Carteret HS (Beaufort, NC)"
119,/register/player.cgi?id=duffie000wil,1991,47,,1223,FrRnd,13,Indians,N,William DuffieåÊ(minors),C,,,,,,,,,,,,,HS,"Irmo HS (Columbia, SC)"
120,/register/player.cgi?id=hughes003rob,1991,47,,1225,FrRnd,15,Tigers,N,Bobby HughesåÊ(minors),C,-0.6,133,319,12,0.238,0.678,,,,,,,JC,"Los Angeles Valley College (Los Angeles, CA)"
121,/register/player.cgi?id=nalepk001kei,1991,47,,1229,FrRnd,19,Rangers,Y,Keith NalepkaåÊ(minors),C,,,,,,,,,,,,,JC,"Montgomery College, Rockville Campus (Rockville, MD)"
122,/register/player.cgi?id=polis-001pet,1991,47,,1231,FrRnd,21,Blue Jays,Y,Pete PolisåÊ(minors),C,,,,,,,,,,,,,JC,"New York City College of Technology (Brooklyn, NY)"
123,/register/player.cgi?id=willia004nic,1991,48,,1245,FrRnd,10,Mariners,N,Nicholas WilliamsåÊ(minors),C,,,,,,,,,,,,,HS,"Hastings HS (Hastings, MI)"
124,/register/player.cgi?id=gildon000joh,1991,48,,1253,FrRnd,18,Reds,N,John GildonåÊ(minors),C,,,,,,,,,,,,,HS,"Pleasant Grove HS (Texarkana, TX)"
125,/register/player.cgi?id=may---002sco,1991,48,,1256,FrRnd,21,Pirates,N,Scott MayåÊ(minors),C,,,,,,,,,,,,,HS,"Manatee HS (Bradenton, FL)"
126,/register/player.cgi?id=wayne-000sco,1991,49,,1262,FrRnd,4,Brewers,N,Scott WayneåÊ(minors),C,,,,,,,,,,,,,HS,"Englewood HS (Littleton, CO)"
127,/register/player.cgi?id=buck--000cor,1991,49,,1277,FrRnd,19,Mets,N,Cory BuckåÊ(minors),C,,,,,,,,,,,,,HS,"Neligh-Oakdale HS (Oakdale, NE)"
128,/register/player.cgi?id=rennsn000dus,1991,51,,1315,FrRnd,14,Dodgers,N,Dustin RennsniesåÊ(minors),C,,,,,,,,,,,,,HS,"A. Crawford Mosley HS (Lynn Haven, FL)"
129,/register/player.cgi?id=crosno000rex,1991,52,,1327,FrRnd,5,Royals,N,Rex CrosnoeåÊ(minors),C,,,,,,,,,,,,,HS,"Central HS (Cape Girardeau, MO)"
130,/register/player.cgi?id=ullan-001dav,1991,52,,1337,FrRnd,15,Rangers,N,Dave UllanåÊ(minors),C,,,,,,,,,,,,,HS,"La Grande HS (La Grande, OR)"
131,/register/player.cgi?id=grob--001rob,1991,53,,1344,FrRnd,2,Braves,Y,Rob GrobåÊ(minors),C,,,,,,,,,,,,,JC,"Frederick Community College (Frederick, MD)"
132,/register/player.cgi?id=bell--001cur,1991,53,,1353,FrRnd,11,Tigers,N,Curt BellåÊ(minors),C,,,,,,,,,,,,,JC,"Indian River Community College (Fort Pierce, FL)"
133,/register/player.cgi?id=mader-001chr,1991,53,,1360,FrRnd,18,White Sox,N,Chris MaderåÊ(minors),C,,,,,,,,,,,,,4Yr,"Rollins College (Winter Park, FL)"
134,/register/player.cgi?id=lara--001car,1991,54,,1363,FrRnd,2,Braves,Y,Carlos LaraåÊ(minors),C,,,,,,,,,,,,,4Yr,"New Mexico Highlands University (Las Vegas, NM)"
135,/register/player.cgi?id=goins-001tim,1991,54,,1367,FrRnd,6,Padres,N,Tim GoinsåÊ(minors),C,,,,,,,,,,,,,4Yr,"St. Mary's University (San Antonio, TX)"
136,/register/player.cgi?id=figuer002ale,1991,54,,1368,FrRnd,7,Phillies,N,Alex FigueroaåÊ(minors),C,,,,,,,,,,,,,HS,"Hawthorne HS (Hawthorne, CA)"
137,/register/player.cgi?id=olsen-001don,1991,55,,1383,FrRnd,12,Astros,N,D.C. OlsenåÊ(minors),C,,,,,,,,,,,,,HS,"Fullerton Union HS (Fullerton, CA)"
138,/register/player.cgi?id=hanson002jam,1991,55,,1387,FrRnd,16,Indians,N,Jamie HansonåÊ(minors),C,,,,,,,,,,,,,HS,"Kentwood HS (Covington, WA)"
139,/register/player.cgi?id=clark-002bri,1991,55,,1391,FrRnd,20,Dodgers,N,Brian ClarkåÊ(minors),C,,,,,,,,,,,,,HS,"Armijo HS (Fairfield, CA)"
140,/register/player.cgi?id=twist-001jef,1991,56,,1398,FrRnd,3,Cardinals,N,Jeff TwiståÊ(minors),C,,,,,,,,,,,,,HS,"Highland HS (Bakersfield, CA)"
141,/register/player.cgi?id=daviss001sea,1991,56,,1405,FrRnd,10,Tigers,N,Sean DavissonåÊ(minors),C,,,,,,,,,,,,,JC,"Sacramento City College (Sacramento, CA)"
142,/register/player.cgi?id=antune002fra,1991,57,,1418,FrRnd,7,Mariners,N,Francisco AntunezåÊ(minors),C,,,,,,,,,,,,,HS,"Papa Juan HS (Bayamon, PR)"
143,/register/player.cgi?id=chasta001dan,1991,57,,1420,FrRnd,9,Expos,N,Dan ChastainåÊ(minors),C,,,,,,,,,,,,,HS,"Fort Collins HS (Fort Collins, CO)"
144,/register/player.cgi?id=tirnko000joh,1991,57,,1421,FrRnd,10,Tigers,N,John TirnkoåÊ(minors),C,,,,,,,,,,,,,JC,"Polk Community College (Winter Haven, FL)"
145,/register/player.cgi?id=warrec001the,1991,57,,1424,FrRnd,13,Rangers,N,Teddy WarreckeråÊ(minors),C,,,,,,,,,,,,,JC,"Allan Hancock College (Santa Maria, CA)"
146,/register/player.cgi?id=bosarg001sco,1991,58,,1432,FrRnd,6,Mariners,Y,Bo BosargeåÊ(minors),C,,,,,,,,,,,,,4Yr,"University of South Alabama (Mobile, AL)"
147,/register/player.cgi?id=sasina000rud,1991,60,,1458,FrRnd,6,Mariners,N,Rudolph SasinaåÊ(minors),C,,,,,,,,,,,,,HS,"Overland HS (Aurora, CO)"
148,/register/player.cgi?id=yelton001rob,1991,61,,1473,FrRnd,9,Tigers,Y,Rob YeltonåÊ(minors),C,,,,,,,,,,,,,4Yr,"Miami University of Ohio (Oxford, OH)"
149,/register/player.cgi?id=dunkin000jar,1991,61,,1475,FrRnd,11,Dodgers,N,Jareld DunkinåÊ(minors),C,,,,,,,,,,,,,HS,"Capitol Hill HS (Oklahoma City, OK)"
150,/register/player.cgi?id=clayto000mic,1991,62,,1484,FrRnd,8,Expos,N,Michael ClaytonåÊ(minors),C,,,,,,,,,,,,,JC,"Mount San Antonio College (Walnut, CA)"
151,/register/player.cgi?id=vanhee000jas,1991,63,,1494,FrRnd,6,Expos,N,Jason VanheerdeåÊ(minors),C,,,,,,,,,,,,,HS,"Dwight D. Eisenhower HS (Rialto, CA)"
152,/register/player.cgi?id=lewis-002jer,1991,65,,1505,FrRnd,1,Yankees,N,Jeremy LewisåÊ(minors),C,,,,,,,,,,,,,HS,"Jefferson HS (Cedar Rapids, IA)"
153,/register/player.cgi?id=marcel000cra,1991,66,,1517,FrRnd,6,Giants,N,Craig MarcelinåÊ(minors),C,,,,,,,,,,,,,JC,"St. Louis Community College, Forest Park Campus (St. Louis, MO)"
154,/register/player.cgi?id=heinem002ric,1991,69,,1535,FrRnd,5,Dodgers,N,Richard HeinemanåÊ(minors),C,,,,,,,,,,,,,HS,"Culver City HS (Culver City, CA)"
155,/register/player.cgi?id=brione001chr,1991,70,,1537,FrRnd,2,Astros,N,Chris BrionesåÊ(minors),C,,,,,,,,,,,,,HS,"Brea Olinda HS (Brea, CA)"
156,/register/player.cgi?id=beck--000jef,1991,71,,1541,FrRnd,2,Astros,N,Jeff BeckåÊ(minors),C,,,,,,,,,,,,,HS,"Mount Vernon HS (Alexandria, VA)"
157,/register/player.cgi?id=irvine000joe,1991,74,,1550,FrRnd,1,Yankees,N,Joel IrvineåÊ(minors),C,,,,,,,,,,,,,JC,"Des Moines Area Community College (Boone, IA)"
158,/register/player.cgi?id=hamik-000jos,1991,75,,1555,FrRnd,3,Dodgers,N,Joshua HamikåÊ(minors),C,,,,,,,,,,,,,HS,"Mount Si HS (Snoqualmie, WA)"
159,/register/player.cgi?id=buggs-000rah,1991,76,,1557,FrRnd,2,Astros,N,Rahasal BuggsåÊ(minors),C,,,,,,,,,,,,,HS,"Morgan Park HS (Chicago, IL)"
160,/register/player.cgi?id=gianno000rob,1991,77,,1560,FrRnd,2,Astros,N,Robert GiannolaåÊ(minors),C,,,,,,,,,,,,,JC,"Ohlone College (Fremont, CA)"
161,/register/player.cgi?id=saltsm000and,1991,87,,1584,FrRnd,2,Dodgers,N,Andy SaltsmanåÊ(minors),C,,,,,,,,,,,,,HS,"Crescenta Valley HS (La Crescenta, CA)"
162,/register/player.cgi?id=stroud002wil,1991,93,,1596,FrRnd,2,Dodgers,N,William StroudåÊ(minors),C,,,,,,,,,,,,,HS,"Dunwoody HS (Dunwoody, GA)"
0,/register/player.cgi?id=gil---001rom,1991,1,,19,FrRnd,19,Rangers,Y,Benji GilåÊ(minors),SS,2.9,604,1610,32,0.237,0.641,,,,,,,HS,"Castle Park HS (Chula Vista, CA)"
1,/register/player.cgi?id=reese-001cal,1991,1,,20,FrRnd,20,Reds,Y,Pokey ReeseåÊ(minors),SS,6.3,856,2833,44,0.248,0.659,,,,,,,HS,"Lower Richland HS (Hopkins, SC)"
2,/register/player.cgi?id=gates-001bre,1991,1,,26,FrRnd,26,Athletics,Y,Brent GatesåÊ(minors),SS,5.5,685,2329,25,0.264,0.685,,,,,,,4Yr,"University of Minnesota (Minneapolis, MN)"
3,/register/player.cgi?id=livese001sha,1991,1s,,29,FrRnd,29,Astros,Y,*Shawn LiveseyåÊ(minors),SS,,,,,,,,,,,,,HS,"Simeon HS (Chicago, IL)"
4,/register/player.cgi?id=powell001lej,1991,1s,,42,FrRnd,42,Blue Jays,N,*Dante PowellåÊ(minors),SS,-0.2,70,74,2,0.27,0.755,,,,,,,HS,"Millikan HS (Long Beach, CA)"
5,/register/player.cgi?id=stocke001kev,1991,2,,54,FrRnd,10,Phillies,Y,Kevin StockeråÊ(minors),SS,5.9,846,2773,23,0.254,0.682,,,,,,,4Yr,"University of Washington (Seattle, WA)"
6,/register/player.cgi?id=legree001joh,1991,3,,77,FrRnd,4,Twins,Y,Keith LegreeåÊ(minors),SS,,,,,,,,,,,,,HS,"Statesboro HS (Statesboro, GA)"
7,/register/player.cgi?id=larocc001tod,1991,3,,91,FrRnd,18,Dodgers,N,Todd LaroccaåÊ(minors),SS,,,,,,,,,,,,,HS,"Lovett School (Atlanta, GA)"
8,/register/player.cgi?id=hanlon001law,1991,3,,92,FrRnd,19,Rangers,Y,Larry HanlonåÊ(minors),SS,,,,,,,,,,,,,4Yr,"University of Texas at Arlington (Arlington, TX)"
9,/register/player.cgi?id=stynes001chr,1991,3,,94,FrRnd,21,Blue Jays,Y,Chris StynesåÊ(minors),SS,8.2,828,2326,51,0.275,0.734,,,,,,,HS,"Boca Raton Community HS (Boca Raton, FL)"
10,/register/player.cgi?id=gerald001dwa,1991,4,,106,FrRnd,7,Royals,Y,Dwayne GeraldåÊ(minors),SS,,,,,,,,,,,,,HS,"St. Paul's HS (St. Paul's, NC)"
11,/register/player.cgi?id=relafo001des,1991,4,,110,FrRnd,11,Mariners,Y,Desi RelafordåÊ(minors),SS,-0.4,939,2939,40,0.243,0.666,1,0,0,0,0,0,HS,"Sandalwood HS (Jacksonville, FL)"
12,/register/player.cgi?id=garcia006ant,1991,5,,130,FrRnd,5,Brewers,N,Nomar GarciaparraåÊ(minors),SS,44.2,1434,5586,229,0.313,0.882,,,,,,,HS,"St. John Bosco HS (Bellflower, CA)"
13,/register/player.cgi?id=halter001sha,1991,5,,132,FrRnd,7,Royals,Y,Shane HalteråÊ(minors),SS,6.4,690,1899,45,0.246,0.688,2,0,0,0,2,0,4Yr,"University of Texas at Austin (Austin, TX)"
14,/register/player.cgi?id=verdus000ste,1991,5,,135,FrRnd,10,Phillies,N,Steve VerduscoåÊ(minors),SS,,,,,,,,,,,,,HS,"Bellarmine College Preparatory (San Jose, CA)"
15,/register/player.cgi?id=knowle001har,1991,6,,152,FrRnd,1,Yankees,Y,Eric KnowlesåÊ(minors),SS,,,,,,,,,,,,,HS,"St. Brendan HS (Miami, FL)"
16,/register/player.cgi?id=failla001pau,1991,7,,184,FrRnd,7,Royals,N,Paul FaillaåÊ(minors),SS,,,,,,,,,,,,,HS,"North Allegheny HS (Wexford, PA)"
17,/register/player.cgi?id=bush--001hom,1991,7,,185,FrRnd,8,Padres,Y,Homer BushåÊ(minors),SS,3,409,1274,11,0.285,0.682,,,,,,,HS,"East St. Louis HS (East St. Louis, IL)"
18,/register/player.cgi?id=womack001ant,1991,7,,201,FrRnd,24,Pirates,Y,Tony WomackåÊ(minors),SS,2.3,1303,4963,36,0.273,0.673,,,,,,,4Yr,"Guilford College (Greensboro, NC)"
19,/register/player.cgi?id=cora--002man,1991,8,,211,FrRnd,8,Padres,Y,Manny CoraåÊ(minors),SS,,,,,,,,,,,,,HS,"Pedro Albizu Campos HS (Levittown, PR)"
20,/register/player.cgi?id=hayden001dav,1991,8,,213,FrRnd,10,Phillies,Y,Dave HaydenåÊ(minors),SS,,,,,,,,,,,,,4Yr,"University of Tennessee (Knoxville, TN)"
21,/register/player.cgi?id=ehmann001kur,1991,8,,220,FrRnd,17,Angels,N,Kurt EhmannåÊ(minors),SS,,,,,,,,,,,,,4Yr,"Arizona State University (Tempe, AZ)"
22,/register/player.cgi?id=thomas000dem,1991,8,,228,FrRnd,25,White Sox,N,Demond ThomasåÊ(minors),SS,,,,,,,,,,,,,HS,"Elizabethtown HS (Elizabethtown, KY)"
23,/register/player.cgi?id=sheldo001sco,1991,8,,229,FrRnd,26,Athletics,Y,Scott SheldonåÊ(minors),SS,-0.4,141,285,8,0.235,0.65,1,0,0,0,0,0,4Yr,"University of Houston (Houston, TX)"
24,/register/player.cgi?id=meade-001pau,1991,9,,242,FrRnd,13,Indians,Y,Paul MeadeåÊ(minors),SS,,,,,,,,,,,,,4Yr,"Oral Roberts University (Tulsa, OK)"
25,/register/player.cgi?id=winick001den,1991,9,,247,FrRnd,18,Dodgers,Y,Dennis WinickiåÊ(minors),SS,,,,,,,,,,,,,HS,"Mona Shores HS (Muskegon, MI)"
26,/register/player.cgi?id=muncy-000mik,1991,10,,256,FrRnd,1,Yankees,N,Mike MuncyåÊ(minors),SS,,,,,,,,,,,,,HS,"Adolfo Camarillo HS (Camarillo, CA)"
27,/register/player.cgi?id=hagy--002gar,1991,10,,272,FrRnd,17,Angels,Y,Gary HagyåÊ(minors),SS,,,,,,,,,,,,,4Yr,"University of California, Los Angeles (Los Angeles, CA)"
28,/register/player.cgi?id=rodrig006lui,1991,10,,278,FrRnd,23,Red Sox,Y,Tony RodriguezåÊ(minors),SS,0.3,27,67,1,0.239,0.59,,,,,,,4Yr,"College of Charleston (Charleston, SC)"
29,/register/player.cgi?id=sanfor001cha,1991,10,,279,FrRnd,24,Pirates,N,Chance SanfordåÊ(minors),SS,-0.7,19,36,0,0.167,0.439,,,,,,,JC,"San Jacinto College (Pasadena, TX)"
30,/register/player.cgi?id=grudzi001mar,1991,11,,295,FrRnd,14,Expos,Y,Mark GrudzielanekåÊ(minors),SS,26.3,1802,7052,90,0.289,0.725,,,,,,,JC,"Trinidad State Junior College (Trinidad, CO)"
31,/register/player.cgi?id=latham001chr,1991,11,,299,FrRnd,18,Dodgers,Y,Chris LathamåÊ(minors),SS,-1,110,213,3,0.202,0.557,,,,,,,HS,"Basic HS (Henderson, NV)"
32,/register/player.cgi?id=wood--001jas,1991,11,,307,FrRnd,26,Athletics,Y,Jason WoodåÊ(minors),SS,0.1,153,200,5,0.245,0.671,1,0,0,0,0,0,4Yr,"California State University Fresno (Fresno, CA)"
33,/register/player.cgi?id=arreod001pau,1991,12,,312,FrRnd,5,Brewers,Unk,Paul ArredondoåÊ(minors),SS,,,,,,,,,,,,,HS,"Colton HS (Colton, CA)"
34,/register/player.cgi?id=mallee001joh,1991,12,,317,FrRnd,10,Phillies,Y,John MalleeåÊ(minors),SS,,,,,,,,,,,,,4Yr,"University of Illinois at Chicago (Chicago, IL)"
35,/register/player.cgi?id=whitak002jef,1991,12,,320,FrRnd,13,Indians,Y,Jeff WhitakeråÊ(minors),SS,,,,,,,,,,,,,HS,"Martinsville HS (Martinsville, VA)"
36,/register/player.cgi?id=brady-001ste,1991,12,,332,FrRnd,25,White Sox,Y,Doug BradyåÊ(minors),SS,0.2,12,21,0,0.19,0.499,,,,,,,4Yr,"Liberty University (Lynchburg, VA)"
37,/register/player.cgi?id=pratte001eva,1991,13,,348,FrRnd,15,Tigers,Y,Evan PratteåÊ(minors),SS,,,,,,,,,,,,,4Yr,"Missouri State University (Springfield, MO)"
38,/register/player.cgi?id=gonzal004ale,1991,13,,354,FrRnd,21,Blue Jays,Y,Alex GonzalezåÊ(minors),SS,11.1,1396,4977,137,0.243,0.694,,,,,,,HS,"Killian HS (Miami, FL)"
39,/register/player.cgi?id=rodart001rau,1991,14,,370,FrRnd,11,Mariners,Y,Raul RodarteåÊ(minors),SS,,,,,,,,,,,,,JC,"Rancho Santiago College (Santa Ana, CA)"
40,/register/player.cgi?id=koelli001bri,1991,14,,379,FrRnd,20,Reds,Y,Brian KoellingåÊ(minors),SS,-0.4,7,15,0,0.067,0.192,,,,,,,4Yr,"Bowling Green State University (Bowling Green, OH)"
41,/register/player.cgi?id=disarc001gle,1991,14,,384,FrRnd,25,White Sox,Y,Glenn DisarcinaåÊ(minors),SS,,,,,,,,,,,,,4Yr,"University of Massachusetts Amherst (Amherst, MA)"
42,/register/player.cgi?id=washin001lam,1991,15,,394,FrRnd,9,Orioles,Y,Lamann WashingtonåÊ(minors),SS,,,,,,,,,,,,,HS,"Beaufort HS (Beaufort, SC)"
43,/register/player.cgi?id=bates-001tho,1991,15,,398,FrRnd,13,Indians,Y,Tommy BatesåÊ(minors),SS,,,,,,,,,,,,,4Yr,"University of Louisiana at Lafayette (Lafayette, LA)"
44,/register/player.cgi?id=swank-001ran,1991,15,,401,FrRnd,16,Giants,Y,Randy SwankåÊ(minors),SS,,,,,,,,,,,,,JC,"American River College (Sacramento, CA)"
45,/register/player.cgi?id=adams-001der,1991,16,,420,FrRnd,9,Orioles,Y,Derek AdamsåÊ(minors),SS,,,,,,,,,,,,,JC,"Louisburg College (Louisburg, NC)"
46,/register/player.cgi?id=tredaw001cha,1991,16,,423,FrRnd,12,Cubs,N,Chad TredawayåÊ(minors),SS,,,,,,,,,,,,,JC,"Seminole Community College (Sanford, FL)"
47,/register/player.cgi?id=rosato000dav,1991,16,,427,FrRnd,16,Giants,N,David RosatoåÊ(minors),SS,,,,,,,,,,,,,HS,"South HS (Torrance, CA)"
48,/register/player.cgi?id=warner001ron,1991,17,,441,FrRnd,4,Cardinals,Y,Ron WarneråÊ(minors),SS,,,,,,,,,,,,,4Yr,"University of Wyoming (Laramie, WY)"
49,/register/player.cgi?id=root--001mit,1991,17,,449,FrRnd,12,Cubs,Y,Mitch RootåÊ(minors),SS,,,,,,,,,,,,,HS,"Chatsworth HS (Chatsworth, CA)"
50,/register/player.cgi?id=harris001dem,1991,17,,462,FrRnd,25,White Sox,Y,Marc HarrisåÊ(minors),SS,,,,,,,,,,,,,HS,"Caesar Rodney HS (Camden, DE)"
51,/register/player.cgi?id=bryant001cra,1991,18,,474,FrRnd,11,Mariners,Y,Craig BryantåÊ(minors),SS,,,,,,,,,,,,,4Yr,"University of North Alabama (Florence, AL)"
52,/register/player.cgi?id=burnet001rog,1991,19,,490,FrRnd,1,Yankees,Y,Roger BurnettåÊ(minors),SS,,,,,,,,,,,,,4Yr,"Stanford University (Palo Alto, CA)"
