,player_link,Year,Rnd,DT,OvPck,FrRnd,RdPck,Tm,Signed,Name,Pos,WAR,G,AB,HR,BA,OPS,G,W,L,ERA,WHIP,SV,Type,Drafted Out of
129,/register/player.cgi?id=robins003ken,1991,10,,276,FrRnd,21,Blue Jays,Y,Ken RobinsonåÊ(minors),RHP,0.6,29,0,0,,,29,2,2,3.91,1.26,0,4Yr,"Florida State University (Tallahassee, FL)"
130,/register/player.cgi?id=sawyer001zac,1991,10,,281,FrRnd,26,Athletics,Y,Zack SawyeråÊ(minors),RHP,,,,,,,,,,,,,HS,"Clinton HS (Clinton, MA)"
131,/register/player.cgi?id=giard-001ken,1991,11,,283,FrRnd,2,Braves,Y,Ken GiardåÊ(minors),RHP,,,,,,,,,,,,,HS,"Toll Gate HS (Warwick, RI)"
132,/register/player.cgi?id=wissle001wil,1991,11,,284,FrRnd,3,Twins,Y,Bill WissleråÊ(minors),RHP,,,,,,,,,,,,,4Yr,"University of Pennsylvania (Philadelphia, PA)"
133,/register/player.cgi?id=weinba001pet,1991,11,,292,FrRnd,11,Mariners,Y,Pete WeinbaumåÊ(minors),RHP,,,,,,,,,,,,,JC,"Nassau Community College (Garden City, NY)"
134,/register/player.cgi?id=kraus-001tim,1991,11,,297,FrRnd,16,Giants,N,Tim KrausåÊ(minors),RHP,,,,,,,,,,,,,HS,"Colerain HS (Cincinnati, OH)"
135,/register/player.cgi?id=knox--001jef,1991,11,,298,FrRnd,17,Angels,Y,Jeff KnoxåÊ(minors),RHP,,,,,,,,,,,,,HS,"Deltona HS (Deltona, FL)"
136,/register/player.cgi?id=schuer001lan,1991,11,,300,FrRnd,19,Rangers,Y,Lance SchuermannåÊ(minors),LHP,,,,,,,,,,,,,4Yr,"University of Nevada-Las Vegas (Las Vegas, NV)"
137,/register/player.cgi?id=dodd--001sco,1991,11,,301,FrRnd,20,Reds,Y,Scott DoddåÊ(minors),LHP,,,,,,,,,,,,,4Yr,"Arizona State University (Tempe, AZ)"
138,/register/player.cgi?id=meiner001ada,1991,11,,302,FrRnd,21,Blue Jays,Y,Adam MeinershagenåÊ(minors),RHP,,,,,,,,,,,,,HS,"Oakville HS (St. Louis, MO)"
139,/register/player.cgi?id=fiegel001tod,1991,11,,303,FrRnd,22,Mets,Y,Todd FiegelåÊ(minors),LHP,,,,,,,,,,,,,4Yr,"University of Virginia (Charlottesville, VA)"
140,/register/player.cgi?id=bullar001pau,1991,11,,305,FrRnd,24,Pirates,Y,Jason BullardåÊ(minors),RHP,,,,,,,,,,,,,4Yr,"Texas A&M; University (College Station, TX)"
141,/register/player.cgi?id=levine001ala,1991,11,,306,FrRnd,25,White Sox,Y,Al LevineåÊ(minors),RHP,6.1,416,2,0,0,0,416,24,33,3.96,1.45,10,4Yr,"Southern Illinois University Carbondale (Carbondale, IL)"
142,/register/player.cgi?id=inman-001ber,1991,12,,308,FrRnd,1,Yankees,Y,Bert InmanåÊ(minors),RHP,,,,,,,,,,,,,JC,"McLennan Community College (Waco, TX)"
143,/register/player.cgi?id=mansur001jef,1991,12,,310,FrRnd,3,Twins,Y,Jeff MansuråÊ(minors),LHP,,,,,,,,,,,,,4Yr,"University of Portland (Portland, OR)"
144,/register/player.cgi?id=badore001mic,1991,12,,311,FrRnd,4,Cardinals,Y,Mike BadorekåÊ(minors),RHP,,,,,,,,,,,,,4Yr,"Olivet Nazarene University (Bourbonnais, IL)"
145,/register/player.cgi?id=biehl-001rod,1991,12,,313,FrRnd,6,Astros,Y,Rod BiehlåÊ(minors),LHP,,,,,,,,,,,,,4Yr,"University of Louisville (Louisville, KY)"
146,/register/player.cgi?id=fyhrie001mic,1991,12,,314,FrRnd,7,Royals,Y,Mike FyhrieåÊ(minors),RHP,2.4,84,2,0,0,0,84,2,11,4,1.43,0,4Yr,"University of California, Los Angeles (Los Angeles, CA)"
147,/register/player.cgi?id=eggles001sco,1991,12,,315,FrRnd,8,Padres,Y,Scott EgglestonåÊ(minors),RHP,,,,,,,,,,,,,JC,"Maple Woods Community College (Kansas City, MO)"
148,/register/player.cgi?id=lisiec001dav,1991,12,,318,FrRnd,11,Mariners,Y,Dave LisieckiåÊ(minors),RHP,,,,,,,,,,,,,JC,"Lake Michigan College (Benton Harbor, MI)"
149,/register/player.cgi?id=luther001tim,1991,12,,323,FrRnd,16,Giants,Y,Tim LutheråÊ(minors),RHP,,,,,,,,,,,,,4Yr,"Missouri Southern State University (Joplin, MO)"
150,/register/player.cgi?id=maire-000ken,1991,12,,324,FrRnd,17,Angels,N,Ken MaireåÊ(minors),RHP,,,,,,,,,,,,,HS,"Eureka HS (Eureka, CA)"
151,/register/player.cgi?id=steph-001rod,1991,12,,327,FrRnd,20,Reds,Y,Rod StephåÊ(minors),RHP,,,,,,,,,,,,,4Yr,"Texas Tech University (Lubbock, TX)"
152,/register/player.cgi?id=jacome001jas,1991,12,,329,FrRnd,22,Mets,Y,Jason JacomeåÊ(minors),LHP,0.9,106,23,0,0.043,0.087,106,10,18,5.34,1.61,1,JC,"Pima Community College (Tucson, AZ)"
153,/register/player.cgi?id=bush--001she,1991,12,,330,FrRnd,23,Red Sox,Y,Craig BushåÊ(minors),RHP,,,,,,,,,,,,,HS,"Lancaster HS (Lancaster, OH)"
154,/register/player.cgi?id=hollin001sta,1991,12,,331,FrRnd,24,Pirates,N,Stacy HollinsåÊ(minors),RHP,,,,,,,,,,,,,JC,"San Jacinto College (Pasadena, TX)"
155,/register/player.cgi?id=jimene002mig,1991,12,,333,FrRnd,26,Athletics,Y,Miguel JimenezåÊ(minors),RHP,-0.4,13,0,0,,,13,2,4,5.9,1.85,0,4Yr,"Fordham University (New York, NY)"
156,/register/player.cgi?id=simmon002sco,1991,13,,337,FrRnd,4,Cardinals,Y,Scott SimmonsåÊ(minors),LHP,,,,,,,,,,,,,4Yr,"Missouri State University (Springfield, MO)"
157,/register/player.cgi?id=browne001byr,1991,13,,338,FrRnd,5,Brewers,Y,Byron BrowneåÊ(minors),RHP,,,,,,,,,,,,,4Yr,"Grand Canyon University (Phoenix, AZ)"
158,/register/player.cgi?id=miller002ant,1991,13,,339,FrRnd,6,Astros,Y,Tony MilleråÊ(minors),LHP,,,,,,,,,,,,,4Yr,"University of Dayton (Dayton, OH)"
159,/register/player.cgi?id=jenkin003kev,1991,13,,344,FrRnd,11,Mariners,Y,Kevin JenkinsåÊ(minors),RHP,,,,,,,,,,,,,HS,"Riverview HS (Riverview, MI)"
160,/register/player.cgi?id=schram001car,1991,13,,345,FrRnd,12,Cubs,Y,Carl SchrammåÊ(minors),RHP,,,,,,,,,,,,,4Yr,"Benedictine University (Lisle, IL)"
161,/register/player.cgi?id=gomez-001mar,1991,13,,349,FrRnd,16,Giants,Y,Marcial GomezåÊ(minors),RHP,,,,,,,,,,,,,HS,"Columbus HS (Hialeah, FL)"
162,/register/player.cgi?id=sebach001kyl,1991,13,,350,FrRnd,17,Angels,Y,Kyle SebachåÊ(minors),RHP,,,,,,,,,,,,,JC,"Grossmont College (El Cajon, CA)"
163,/register/player.cgi?id=fitzpa002dav,1991,13,,351,FrRnd,18,Dodgers,Y,Dave FitzpatrickåÊ(minors),RHP,,,,,,,,,,,,,HS,"Sullivan South HS (Kingsport, TN)"
164,/register/player.cgi?id=heathc001mic,1991,13,,358,FrRnd,25,White Sox,Y,Mike HeathcottåÊ(minors),RHP,0.1,1,0,0,,,1,0,0,3,1,0,4Yr,"Creighton University (Omaha, NE)"
165,/register/player.cgi?id=short-001ben,1991,14,,360,FrRnd,1,Yankees,Y,Ben ShortåÊ(minors),RHP,,,,,,,,,,,,,4Yr,"University of Alabama (Tuscaloosa, AL)"
166,/register/player.cgi?id=lomon-001kev,1991,14,,361,FrRnd,2,Braves,Y,Kevin LomonåÊ(minors),RHP,-0.1,12,0,0,,,12,0,1,5.94,1.92,0,4Yr,"University of Arkansas-Fort Smith (Fort Smith, AR)"
167,/register/player.cgi?id=busby-001mic,1991,14,,363,FrRnd,4,Cardinals,Y,Mike BusbyåÊ(minors),RHP,-0.9,45,9,0,0.333,0.733,45,5,6,6.48,1.66,0,HS,"Phineas Banning HS (Wilmington, CA)"
168,/register/player.cgi?id=trisle001joh,1991,14,,364,FrRnd,5,Brewers,Y,John TrisleråÊ(minors),RHP,,,,,,,,,,,,,4Yr,"Indiana State University (Terre Haute, IN)"
169,/register/player.cgi?id=macias002ang,1991,14,,366,FrRnd,7,Royals,Y,Angel MaciasåÊ(minors),RHP,,,,,,,,,,,,,JC,"East Los Angeles College (Monterey Park, CA)"
170,/register/player.cgi?id=burlin001ben,1991,14,,371,FrRnd,12,Cubs,Y,Ben BurlingameåÊ(minors),RHP,,,,,,,,,,,,,4Yr,"University of Maine at Orono (Orono, ME)"
171,/register/player.cgi?id=jewell001mic,1991,14,,372,FrRnd,13,Indians,Y,Michael JewellåÊ(minors),RHP,,,,,,,,,,,,,JC,"Sacramento City College (Sacramento, CA)"
172,/register/player.cgi?id=young-001fre,1991,14,,376,FrRnd,17,Angels,Y,Fred YoungåÊ(minors),RHP,,,,,,,,,,,,,HS,"Hillsborough HS (Tampa, FL)"
173,/register/player.cgi?id=legend001rob,1991,14,,377,FrRnd,18,Dodgers,Y,Bob LegendreåÊ(minors),RHP,,,,,,,,,,,,,JC,"Cypress College (Cypress, CA)"
174,/register/player.cgi?id=beltra001alo,1991,14,,380,FrRnd,21,Blue Jays,Y,Alonso BeltranåÊ(minors),RHP,,,,,,,,,,,,,JC,"New Mexico Junior College (Hobbs, NM)"
175,/register/player.cgi?id=hender001jef,1991,14,,381,FrRnd,22,Mets,Y,Jeff HendersonåÊ(minors),RHP,,,,,,,,,,,,,JC,"Golden West College (Huntington Beach, CA)"
176,/register/player.cgi?id=may---001dar,1991,14,,385,FrRnd,26,Athletics,N,Darrell MayåÊ(minors),LHP,5.6,161,26,0,0.077,0.188,161,26,43,5.16,1.45,0,JC,"Sacramento City College (Sacramento, CA)"
177,/register/player.cgi?id=munda-001ste,1991,15,,386,FrRnd,1,Yankees,Y,Steve MundaåÊ(minors),RHP,,,,,,,,,,,,,4Yr,"University of Illinois at Urbana-Champaign (Champaign, IL)"
178,/register/player.cgi?id=lairse001eri,1991,15,,387,FrRnd,2,Braves,Y,Eric LairseyåÊ(minors),LHP,,,,,,,,,,,,,HS,"Pierce County HS (Blackshear, GA)"
179,/register/player.cgi?id=connol001chr,1991,15,,392,FrRnd,7,Royals,Y,Chris ConnollyåÊ(minors),LHP,,,,,,,,,,,,,4Yr,"Radford University (Radford, VA)"
180,/register/player.cgi?id=atchle001jus,1991,15,,393,FrRnd,8,Padres,N,Justin AtchleyåÊ(minors),LHP,0,15,1,0,0,0,15,0,0,6.1,1.65,0,HS,"Sedro-Woolley HS (Sedro-Woolley, WA)"
181,/register/player.cgi?id=anders001dou,1991,15,,396,FrRnd,11,Mariners,Y,Doug AndersonåÊ(minors),LHP,,,,,,,,,,,,,4Yr,"University of North Florida (Jacksonville, FL)"
182,/register/player.cgi?id=fergus007jam,1991,15,,399,FrRnd,14,Expos,Y,Jim FergusonåÊ(minors),RHP,,,,,,,,,,,,,4Yr,"University of California, San Diego (La Jolla, CA)"
183,/register/player.cgi?id=stidha001phi,1991,15,,400,FrRnd,15,Tigers,Y,Phil StidhamåÊ(minors),RHP,-0.5,5,0,0,,,5,0,0,24.92,3.69,0,4Yr,"University of Arkansas (Fayetteville, AR)"
184,/register/player.cgi?id=keling002kor,1991,15,,402,FrRnd,17,Angels,Y,Korey KelingåÊ(minors),RHP,,,,,,,,,,,,,4Yr,"University of Oklahoma (Norman, OK)"
185,/register/player.cgi?id=lacy--001ker,1991,15,,404,FrRnd,19,Rangers,Y,Kerry LacyåÊ(minors),RHP,-0.5,44,0,0,,,44,3,1,5.59,1.86,3,JC,"Chattanooga State Technical Community College (Chattanooga, TN)"
186,/register/player.cgi?id=petroc001chr,1991,15,,407,FrRnd,22,Mets,N,Chris PetrocellaåÊ(minors),RHP,,,,,,,,,,,,,JC,"Fort Scott Community College (Fort Scott, KS)"
187,/register/player.cgi?id=bailey001phi,1991,15,,408,FrRnd,23,Red Sox,Y,Cory BaileyåÊ(minors),RHP,2.8,172,2,0,0.5,1.25,172,9,10,3.96,1.57,1,JC,"Southeastern Illinois College (Harrisburg, IL)"
188,/register/player.cgi?id=fronte002cha,1991,15,,410,FrRnd,25,White Sox,Y,Charles FronteraåÊ(minors),RHP,,,,,,,,,,,,,HS,"Bishop Ford Central Catholic HS (Brooklyn, NY)"
189,/register/player.cgi?id=crogha001and,1991,16,,412,FrRnd,1,Yankees,Y,Andy CroghanåÊ(minors),RHP,,,,,,,,,,,,,4Yr,"California State University Long Beach (Long Beach, CA)"
190,/register/player.cgi?id=havens001wil,1991,16,,413,FrRnd,2,Braves,Y,Will HavensåÊ(minors),RHP,,,,,,,,,,,,,HS,"Holmes HS (San Antonio, TX)"
191,/register/player.cgi?id=johnso032rob,1991,16,,414,FrRnd,3,Twins,N,Rob JohnsonåÊ(minors),RHP,,,,,,,,,,,,,HS,"El Toro HS (Lake Forest, CA)"
192,/register/player.cgi?id=lucero001kev,1991,16,,415,FrRnd,4,Cardinals,Y,Kevin LuceroåÊ(minors),LHP,,,,,,,,,,,,,4Yr,"Florida International University (Miami, FL)"
193,/register/player.cgi?id=bailey001mic,1991,16,,418,FrRnd,7,Royals,Y,Mike BaileyåÊ(minors),RHP,,,,,,,,,,,,,JC,"Tallahassee Community College (Tallahassee, FL)"
194,/register/player.cgi?id=bojcun001pat,1991,16,,421,FrRnd,10,Phillies,Y,Pat BojcunåÊ(minors),RHP,,,,,,,,,,,,,4Yr,"Central Michigan University (Mount Pleasant, MI)"
195,/register/player.cgi?id=sulliv004dan,1991,16,,422,FrRnd,11,Mariners,Y,Dan SullivanåÊ(minors),RHP,,,,,,,,,,,,,JC,"Indian River Community College (Fort Pierce, FL)"
196,/register/player.cgi?id=koller001rod,1991,16,,424,FrRnd,13,Indians,Y,Rod KolleråÊ(minors),RHP,,,,,,,,,,,,,4Yr,"Southern Arkansas University (Magnolia, AR)"
197,/register/player.cgi?id=jenkin001bud,1991,16,,425,FrRnd,14,Expos,Y,Buddy JenkinsåÊ(minors),LHP,,,,,,,,,,,,,4Yr,"Wake Forest University (Winston-Salem, NC)"
198,/register/player.cgi?id=bussa-001tod,1991,16,,426,FrRnd,15,Tigers,Y,Todd BussaåÊ(minors),RHP,,,,,,,,,,,,,HS,"Palm Beach Gardens HS (Palm Beach Gardens, FL)"
199,/register/player.cgi?id=purdy-001sha,1991,16,,428,FrRnd,17,Angels,Y,Shawn PurdyåÊ(minors),RHP,,,,,,,,,,,,,4Yr,"University of Miami (Coral Gables, FL)"
200,/register/player.cgi?id=sinaco001chr,1991,16,,429,FrRnd,18,Dodgers,Y,Chris SinacoriåÊ(minors),RHP,,,,,,,,,,,,,4Yr,"Florida International University (Miami, FL)"
201,/register/player.cgi?id=starr-001chr,1991,16,,430,FrRnd,19,Rangers,Y,Chris StarråÊ(minors),RHP,,,,,,,,,,,,,4Yr,"Muskingum College (New Concord, OH)"
202,/register/player.cgi?id=hardwi001bil,1991,16,,431,FrRnd,20,Reds,N,Bubba HardwickåÊ(minors),LHP,,,,,,,,,,,,,JC,"Polk Community College (Winter Haven, FL)"
203,/register/player.cgi?id=gernan001dan,1991,16,,435,FrRnd,24,Pirates,Y,Dan GernandåÊ(minors),RHP,,,,,,,,,,,,,JC,"Arizona Western College (Yuma, AZ)"
204,/register/player.cgi?id=kubick001mar,1991,16,,436,FrRnd,25,White Sox,Y,Marc KubickiåÊ(minors),RHP,,,,,,,,,,,,,4Yr,"University of Southern Mississippi (Hattiesburg, MS)"
205,/register/player.cgi?id=rigby-001bra,1991,17,,438,FrRnd,1,Yankees,N,Brad RigbyåÊ(minors),RHP,0.5,73,4,0,0,0,73,5,13,5.5,1.61,2,HS,"Lake Brantley HS (Altamonte Springs, FL)"
206,/register/player.cgi?id=shafer001wil,1991,17,,439,FrRnd,2,Braves,Y,Bill ShaferåÊ(minors),RHP,,,,,,,,,,,,,HS,"South Grand Prairie HS (Grand Prairie, TX)"
207,/register/player.cgi?id=kunz--000eri,1991,17,,440,FrRnd,3,Twins,N,Eric KunzåÊ(minors),RHP,,,,,,,,,,,,,HS,"Keller HS (Keller, TX)"
208,/register/player.cgi?id=olaugh001cha,1991,17,,442,FrRnd,5,Brewers,Y,Chad O'LaughlinåÊ(minors),LHP,,,,,,,,,,,,,JC,"Southwestern College (Chula Vista, CA)"
209,/register/player.cgi?id=frankl001joe,1991,17,,446,FrRnd,9,Orioles,N,Joel FranklinåÊ(minors),RHP,,,,,,,,,,,,,HS,"Coronado HS (Coronado, CA)"
210,/register/player.cgi?id=winzer001ken,1991,17,,448,FrRnd,11,Mariners,Y,Kenny WinzeråÊ(minors),RHP,,,,,,,,,,,,,4Yr,"Southern University and A&M; College (Baton Rouge, LA)"
211,/register/player.cgi?id=key---001wad,1991,17,,450,FrRnd,13,Indians,Y,Denny KeyåÊ(minors),RHP,,,,,,,,,,,,,JC,"Spartanburg Methodist College (Spartanburg, SC)"
212,/register/player.cgi?id=taruti001s--,1991,17,,451,FrRnd,14,Expos,Y,Pete TarutisåÊ(minors),RHP,,,,,,,,,,,,,4Yr,"University of Scranton (Scranton, PA)"
213,/register/player.cgi?id=ruyak-001tod,1991,17,,452,FrRnd,15,Tigers,N,Todd RuyakåÊ(minors),LHP,,,,,,,,,,,,,4Yr,"University of Virginia (Charlottesville, VA)"
214,/register/player.cgi?id=willia001sha,1991,17,,454,FrRnd,17,Angels,Y,Shad WilliamsåÊ(minors),RHP,-1,14,0,0,,,14,0,2,8.59,2.22,0,JC,"Fresno City College (Fresno, CA)"
215,/register/player.cgi?id=zerbe-001wil,1991,17,,455,FrRnd,18,Dodgers,Y,Chad ZerbeåÊ(minors),LHP,0.5,114,20,0,0.15,0.3,114,6,1,3.87,1.36,0,JC,"Hillsborough Community College (Tampa, FL)"
216,/register/player.cgi?id=crawfo001jos,1991,17,,459,FrRnd,22,Mets,Y,Joe CrawfordåÊ(minors),LHP,0.4,19,11,0,0,0,19,4,3,3.3,1.06,0,4Yr,"Kent State University (Kent, OH)"
217,/register/player.cgi?id=vanegm001tim,1991,17,,460,FrRnd,23,Red Sox,Y,Tim Van EgmondåÊ(minors),RHP,0.3,23,0,0,,,23,5,9,5.96,1.56,0,4Yr,"Jacksonville State University (Jacksonville, AL)"
218,/register/player.cgi?id=colema001joh,1991,18,,464,FrRnd,1,Yankees,Y,Billy ColemanåÊ(minors),RHP,,,,,,,,,,,,,4Yr,"Northwood University (Cedar Hill, TX)"
219,/register/player.cgi?id=sartai001dav,1991,18,,466,FrRnd,3,Twins,Y,David SartainåÊ(minors),LHP,,,,,,,,,,,,,4Yr,"Virginia Commonwealth University (Richmond, VA)"
220,/register/player.cgi?id=compto002rob,1991,18,,471,FrRnd,8,Padres,Y,Clint ComptonåÊ(minors),RHP,,,,,,,,,,,,,JC,"Seminole Community College (Sanford, FL)"
221,/register/player.cgi?id=lane--002jos,1991,18,,472,FrRnd,9,Orioles,N,Aaron LaneåÊ(minors),LHP,,,,,,,,,,,,,JC,"Lincoln Land Community College (Springfield, IL)"
222,/register/player.cgi?id=humphr001tre,1991,18,,475,FrRnd,12,Cubs,N,Trevor HumphryåÊ(minors),RHP,,,,,,,,,,,,,4Yr,"University of Arkansas-Fort Smith (Fort Smith, AR)"
223,/register/player.cgi?id=rueter001kir,1991,18,,477,FrRnd,14,Expos,Y,Kirk RueteråÊ(minors),LHP,16.7,349,622,0,0.153,0.354,340,130,92,4.27,1.39,0,4Yr,"Murray State University (Murray, KY)"
224,/register/player.cgi?id=brown-002kev,1991,18,,479,FrRnd,16,Giants,Y,Kevin BrownåÊ(minors),RHP,,,,,,,,,,,,,HS,"North Salem HS (Salem, OR)"
225,/register/player.cgi?id=gledhi001joh,1991,18,,480,FrRnd,17,Angels,Y,Chance GledhillåÊ(minors),RHP,,,,,,,,,,,,,4Yr,"Oklahoma City University (Oklahoma City, OK)"
226,/register/player.cgi?id=smith-005jos,1991,18,,481,FrRnd,18,Dodgers,Y,Jo Jo SmithåÊ(minors),LHP,,,,,,,,,,,,,4Yr,"Vanderbilt University (Nashville, TN)"
227,/register/player.cgi?id=magee-001dan,1991,18,,482,FrRnd,19,Rangers,Y,Bo MageeåÊ(minors),LHP,,,,,,,,,,,,,4Yr,"Jackson State University (Jackson, MS)"
228,/register/player.cgi?id=colett001joh,1991,18,,483,FrRnd,20,Reds,Y,Mike ColettiåÊ(minors),LHP,,,,,,,,,,,,,4Yr,"Oklahoma City University (Oklahoma City, OK)"
229,/register/player.cgi?id=pelka-001bri,1991,18,,487,FrRnd,24,Pirates,N,Brian PelkaåÊ(minors),RHP,,,,,,,,,,,,,JC,"Allegheny College (Meadville, PA)"
230,/register/player.cgi?id=rathke000jes,1991,19,,491,FrRnd,2,Braves,N,Jes RathkeåÊ(minors),RHP,,,,,,,,,,,,,HS,"Brownwood HS (Brownwood, TX)"
231,/register/player.cgi?id=currie001bry,1991,19,,496,FrRnd,7,Royals,N,Bryan CurrieråÊ(minors),RHP,,,,,,,,,,,,,JC,"North Harris Community College (Montgomery, TX)"
232,/register/player.cgi?id=salamo001joh,1991,19,,499,FrRnd,10,Phillies,Y,John SalamonåÊ(minors),RHP,,,,,,,,,,,,,JC,"Allegheny College (Meadville, PA)"
233,/register/player.cgi?id=philli002ant,1991,19,,500,FrRnd,11,Mariners,Y,Tony PhillipsåÊ(minors),RHP,,,,,,,,,,,,,4Yr,"University of Southern Mississippi (Hattiesburg, MS)"
234,/register/player.cgi?id=maffet001chr,1991,19,,502,FrRnd,13,Indians,Y,Chris MaffettåÊ(minors),RHP,,,,,,,,,,,,,HS,"Southport HS (Indianapolis, IN)"
235,/register/player.cgi?id=goreck001ric,1991,19,,507,FrRnd,18,Dodgers,Y,Rick GoreckiåÊ(minors),RHP,-0.2,7,0,0,,,7,2,2,7.54,1.76,0,HS,"Oak Forest HS (Oak Forest, IL)"
236,/register/player.cgi?id=piscio001mar,1991,19,,513,FrRnd,24,Pirates,Y,Marc PisciottaåÊ(minors),RHP,0.9,75,4,0,0.25,0.5,75,4,5,4.24,1.62,0,4Yr,"Georgia Institute of Technology (Atlanta, GA)"
237,/register/player.cgi?id=pujals001den,1991,19,,514,FrRnd,25,White Sox,N,Denis PujalsåÊ(minors),RHP,,,,,,,,,,,,,HS,"Southwest Miami HS (Miami, FL)"
238,/register/player.cgi?id=hender011jam,1991,19,,515,FrRnd,26,Athletics,N,James HendersonåÊ(minors),RHP,,,,,,,,,,,,,4Yr,"Purdue University (West Lafayette, IN)"
239,/register/player.cgi?id=hisey-001jas,1991,20,,519,FrRnd,4,Cardinals,Y,Jason HiseyåÊ(minors),RHP,,,,,,,,,,,,,4Yr,"University of Arizona (Tucson, AZ)"
240,/register/player.cgi?id=hancoc001mic,1991,20,,520,FrRnd,5,Brewers,Y,Brian HancockåÊ(minors),LHP,,,,,,,,,,,,,JC,"Volunteer State Community College (Gallatin, TN)"
241,/register/player.cgi?id=white-002chr,1991,20,,521,FrRnd,6,Astros,Y,Chris WhiteåÊ(minors),RHP,,,,,,,,,,,,,4Yr,"Cleveland State University (Cleveland, OH)"
242,/register/player.cgi?id=downs-001joh,1991,20,,522,FrRnd,7,Royals,Y,John DownsåÊ(minors),RHP,,,,,,,,,,,,,JC,"Muscatine Community College (Muscatine, IA)"
243,/register/player.cgi?id=plaste001dav,1991,20,,524,FrRnd,9,Orioles,Y,Allen PlasteråÊ(minors),RHP,,,,,,,,,,,,,4Yr,"University of North Carolina at Charlotte (Charlotte, NC)"
244,/register/player.cgi?id=desant001dom,1991,20,,525,FrRnd,10,Phillies,Y,Dom DeSantisåÊ(minors),RHP,,,,,,,,,,,,,4Yr,"University of New Orleans (New Orleans, LA)"
245,/register/player.cgi?id=odonne001eri,1991,20,,526,FrRnd,11,Mariners,Y,Erik O'DonnellåÊ(minors),RHP,,,,,,,,,,,,,4Yr,"University of Portland (Portland, OR)"
246,/register/player.cgi?id=lopez-001alb,1991,20,,528,FrRnd,13,Indians,Y,Albie LopezåÊ(minors),RHP,3.7,297,46,0,0.043,0.146,297,47,58,4.94,1.52,4,JC,"Mesa Community College (Mesa, AZ)"
247,/register/player.cgi?id=fasten000jam,1991,20,,529,FrRnd,14,Expos,Y,Jamal FasteningåÊ(minors),RHP,,,,,,,,,,,,,HS,"Vintage HS (Napa, CA)"
248,/register/player.cgi?id=kelley002ric,1991,20,,530,FrRnd,15,Tigers,Y,Rich KelleyåÊ(minors),LHP,,,,,,,,,,,,,4Yr,"Jacksonville University (Jacksonville, FL)"
249,/register/player.cgi?id=stonec001eri,1991,20,,531,FrRnd,16,Giants,Y,Eric StonecipheråÊ(minors),RHP,,,,,,,,,,,,,4Yr,"University of Kansas (Lawrence, KS)"
250,/register/player.cgi?id=kloek-001kev,1991,20,,532,FrRnd,17,Angels,N,Kevin KloekåÊ(minors),RHP,,,,,,,,,,,,,JC,"Citrus College (Glendora, CA)"
251,/register/player.cgi?id=stephe004wil,1991,20,,533,FrRnd,18,Dodgers,Y,Bill StephensåÊ(minors),RHP,,,,,,,,,,,,,HS,"Ringgold HS (Ringgold, GA)"
252,/register/player.cgi?id=weber-001ben,1991,20,,536,FrRnd,21,Blue Jays,Y,Ben WeberåÊ(minors),RHP,3.1,228,0,0,,,228,19,8,3.77,1.44,7,4Yr,"University of Houston (Houston, TX)"
253,/register/player.cgi?id=cotner001and,1991,20,,537,FrRnd,22,Mets,Y,Andy CotneråÊ(minors),LHP,,,,,,,,,,,,,4Yr,"Illinois State University (Normal, IL)"
254,/register/player.cgi?id=martin002ces,1991,20,,538,FrRnd,23,Red Sox,Y,Cesar MartinezåÊ(minors),LHP,,,,,,,,,,,,,HS,"Chula Vista HS (Chula Vista, CA)"
255,/register/player.cgi?id=call--001mic,1991,20,,540,FrRnd,25,White Sox,Y,Michael CallåÊ(minors),RHP,,,,,,,,,,,,,4Yr,"University of Washington (Seattle, WA)"
256,/register/player.cgi?id=montan001iva,1991,20,,541,FrRnd,26,Athletics,N,Ivan MontaneåÊ(minors),RHP,,,,,,,,,,,,,HS,"Killian HS (Miami, FL)"
257,/register/player.cgi?id=gully-001sco,1991,21,,542,FrRnd,1,Yankees,Y,Scott GullyåÊ(minors),RHP,,,,,,,,,,,,,4Yr,"Elon University (Elon, NC)"
258,/register/player.cgi?id=hostet001mic,1991,21,,543,FrRnd,2,Braves,Y,Mike HostetleråÊ(minors),RHP,,,,,,,,,,,,,4Yr,"Georgia Institute of Technology (Atlanta, GA)"
259,/register/player.cgi?id=lewis-003mic,1991,21,,544,FrRnd,3,Twins,Y,Mike LewisåÊ(minors),LHP,,,,,,,,,,,,,4Yr,"University of California, Los Angeles (Los Angeles, CA)"
260,/register/player.cgi?id=gorrel001rob,1991,21,,546,FrRnd,5,Brewers,Y,Rob GorrellåÊ(minors),RHP,,,,,,,,,,,,,4Yr,"Arizona State University (Tempe, AZ)"
261,/register/player.cgi?id=waring001jam,1991,21,,547,FrRnd,6,Astros,Y,Jim WaringåÊ(minors),RHP,,,,,,,,,,,,,4Yr,"Stetson University (DeLand, FL)"
262,/register/player.cgi?id=farsac001dav,1991,21,,548,FrRnd,7,Royals,Y,Dave FarsaciåÊ(minors),RHP,,,,,,,,,,,,,4Yr,"High Point University (High Point, NC)"
263,/register/player.cgi?id=weston002mic,1991,21,,549,FrRnd,8,Padres,N,Michael WestonåÊ(minors),LHP,,,,,,,,,,,,,HS,"Lower Richland HS (Hopkins, SC)"
264,/register/player.cgi?id=brown-001gre,1991,21,,551,FrRnd,10,Phillies,Y,Greg BrownåÊ(minors),RHP,,,,,,,,,,,,,4Yr,"University of Tennessee (Knoxville, TN)"
265,/register/player.cgi?id=forema001tob,1991,21,,552,FrRnd,11,Mariners,Y,Toby ForemanåÊ(minors),LHP,,,,,,,,,,,,,4Yr,"St. Mary's College of California (Moraga, CA)"
266,/register/player.cgi?id=clemon001chr,1991,21,,553,FrRnd,12,Cubs,N,Chris ClemonsåÊ(minors),RHP,-0.3,5,0,0,,,5,0,2,8.53,2.37,0,HS,"McGregor HS (McGregor, TX)"
267,/register/player.cgi?id=dalzoc001pau,1991,21,,560,FrRnd,19,Rangers,Y,Paul DalzochioåÊ(minors),RHP,,,,,,,,,,,,,4Yr,"University of California, Berkeley (Berkeley, CA)"
268,/register/player.cgi?id=jarvis001kev,1991,21,,561,FrRnd,20,Reds,Y,Kevin JarvisåÊ(minors),RHP,-3.9,191,188,1,0.16,0.431,187,34,49,6.03,1.54,1,4Yr,"Wake Forest University (Winston-Salem, NC)"
269,/register/player.cgi?id=lindsa001tim,1991,21,,562,FrRnd,21,Blue Jays,Y,Tim LindsayåÊ(minors),RHP,,,,,,,,,,,,,4Yr,"University of California, Los Angeles (Los Angeles, CA)"
270,/register/player.cgi?id=bennet001joe,1991,21,,564,FrRnd,23,Red Sox,Y,Joel BennettåÊ(minors),RHP,-0.5,7,4,0,0,0.2,7,2,1,8.53,2,0,4Yr,"East Stroudsburg University of Pennsylvania (East Stroudsburg, PA)"
271,/register/player.cgi?id=ingram001tod,1991,21,,567,FrRnd,26,Athletics,Y,Todd IngramåÊ(minors),RHP,,,,,,,,,,,,,4Yr,"University of Arizona (Tucson, AZ)"
272,/register/player.cgi?id=baldwi001sco,1991,22,,568,FrRnd,1,Yankees,N,Scott BaldwinåÊ(minors),LHP,,,,,,,,,,,,,4Yr,"Lewis-Clark State College (Lewiston, ID)"
273,/register/player.cgi?id=karp--001rya,1991,22,,569,FrRnd,2,Braves,N,Ryan KarpåÊ(minors),LHP,-0.4,16,0,0,,,16,1,1,5.29,1.47,0,4Yr,"University of Miami (Coral Gables, FL)"
274,/register/player.cgi?id=hensle000rei,1991,22,,570,FrRnd,3,Twins,N,Reid HensleyåÊ(minors),RHP,,,,,,,,,,,,,HS,"Marian HS (Lansing, IL)"
275,/register/player.cgi?id=longak001sco,1991,22,,571,FrRnd,4,Cardinals,Y,Scott LongakeråÊ(minors),RHP,,,,,,,,,,,,,4Yr,"University of California, Santa Barbara (Santa Barbara, CA)"
276,/register/player.cgi?id=bennet002mat,1991,22,,574,FrRnd,7,Royals,Y,Matt BennettåÊ(minors),RHP,,,,,,,,,,,,,HS,"Grace Davis HS (Modesto, CA)"
277,/register/player.cgi?id=grygie001jos,1991,22,,575,FrRnd,8,Padres,Y,Joe GrygielåÊ(minors),LHP,,,,,,,,,,,,,4Yr,"University of Massachusetts Lowell (Lowell, MA)"
278,/register/player.cgi?id=chatte001chr,1991,22,,576,FrRnd,9,Orioles,Y,Chris ChattertonåÊ(minors),RHP,,,,,,,,,,,,,4Yr,"High Point University (High Point, NC)"
279,/register/player.cgi?id=holman001cra,1991,22,,577,FrRnd,10,Phillies,Y,Craig HolmanåÊ(minors),RHP,,,,,,,,,,,,,4Yr,"Jacksonville State University (Jacksonville, AL)"
280,/register/player.cgi?id=goodso002jam,1991,22,,579,FrRnd,12,Cubs,Y,Kirk GoodsonåÊ(minors),RHP,,,,,,,,,,,,,4Yr,"Bluefield College (Bluefield, VA)"
281,/register/player.cgi?id=davids001gra,1991,22,,580,FrRnd,13,Indians,Y,Grady DavidsonåÊ(minors),LHP,,,,,,,,,,,,,4Yr,"Southern University and A&M; College (Baton Rouge, LA)"
282,/register/player.cgi?id=calmus001lan,1991,22,,581,FrRnd,14,Expos,N,Lance CalmusåÊ(minors),RHP,,,,,,,,,,,,,HS,"Jenks HS (Jenks, OK)"
283,/register/player.cgi?id=schwar001tho,1991,22,,582,FrRnd,15,Tigers,Y,Tom SchwarberåÊ(minors),RHP,,,,,,,,,,,,,4Yr,"The Ohio State University (Columbus, OH)"
284,/register/player.cgi?id=foster002cli,1991,22,,587,FrRnd,20,Reds,N,Cliff FosteråÊ(minors),RHP,,,,,,,,,,,,,JC,"Angelina College (Lufkin, TX)"
285,/register/player.cgi?id=dolson001and,1991,22,,588,FrRnd,21,Blue Jays,Y,Andy DolsonåÊ(minors),LHP,,,,,,,,,,,,,4Yr,"Troy University (Troy, AL)"
286,/register/player.cgi?id=collie001erv,1991,22,,589,FrRnd,22,Mets,Y,Ervin CollieråÊ(minors),RHP,,,,,,,,,,,,,HS,"County Central HS (New Madrid, MO)"
